Company Name,Company Website URL,News Story URL,Headline,Publication Date,Publisher or Source,GPT Summary
1 Source Design Ltd.,http://1-sourcedesign.com/,https://www.ctemag.com/news/cad-solution-multi-user-facility,CAD solution for multi-user facility,10/1/2019,Cutting Tool Engineering,"• Adopted Kisters 3DViewStation to enable collaborative design reviews without many CAD seats 
• “We chose 3DViewStation as our go-to alternative to multiple, expensive CAD licenses,” — Douglas Davis, Sales Engineer 
• No photo caption appears"
Harris Precision Mold,http://www.hpmold.com,https://www.hpmold.com/,Company Profile: Harris Precision Mold,1/1/2023,Official Website,"• Specializes in Class 101 plastic injection molds including 2-shot, unscrewing, and shuttle designs 
• Serves medical, pharmaceutical, and packaging industries 
• Operates in Tempe, AZ and West Jordan, UT 
• Provides engineering and repair services with SolidWorks, SurfCam, Esprit software 
• No direct quotes appear in this profile."
Harris Precision Mold,http://www.hpmold.com,https://www.dnb.com/business-directory/company-profiles.harris-precision_mold__manufacturing_inc.d8e4402c1728556ecea803b51969956b.html,Business Directory Listing for Harris Precision Mold,6/1/2023,Dun & Bradstreet,"• Confirms Harris Precision Mold as a precision molding firm 
• Provides address and business classification in Tempe, Arizona 
• No direct quotes appear in this listing."
M.R. Mold & Engineering,http://www.mrmold.com,https://www.rubbernews.com/expansion/mr-mold-moving-larger-site-california,MR Mold moving to larger site in California,11/14/2019,Rubber News,"• Reports move to larger Brea, CA facility as prior complex slated for demolition 
• Expansion addresses space needs for growing LSR tooling projects 
• No direct quotes appear in this article"
M.R. Mold & Engineering,http://www.mrmold.com,https://www.rubbernews.com/coronavirus/mr-mold-stays-open-amidst-shelter-place-order,M.R. Mold stays open amidst shelter-in-place order,3/20/2020,Rubber News,"• Confirms essential manufacturer status during early COVID-19 response 
• Outlines safety measures and continuity plans for medical tooling customers 
• No direct quotes appear in this article"
"Prestige Mold, Inc.",http://www.prestigemold.com,https://www.moldmakingtechnology.com/articles/collaboration-creates-first-of-its-kind-multi-cavity-hot-runner-mold-for-intricate-medical-parts,Collaboration creates first-of-its-kind multi-cavity hot runner mold for intricate medical parts,4/28/2015,MoldMaking Technology,"• Case study with Eastman Chemical, Mold-Masters and Pres‑Tek on intricate medical tooling 
• Design-phase collaboration and rheology work emphasized 
• No direct quotes appear in this article"
"Prestige Mold, Inc.",http://www.prestigemold.com,https://www.plasticsnews.com/article/20120309/NEWS/303099974/prestige-mold-spins-off-molding-business,Prestige Mold spins off molding business,3/9/2012,Plastics News,"• Reports creation of Pres‑Tek Plastics as separate entity from Prestige Mold 
• Strategic focus to separate molding from tooling operations 
• No direct quotes appear in this article"
Source One Plastics,http://www.source-one.net,https://www.ptonline.com/news/source-one-plastics-starts-up-plastic-waste-sorting-and-recycling-facility,Source One Plastics Starts Up Plastic Waste Sorting and Recycling Facility,3/7/2024,Plastics Technology,"• Source One Plastics opened new facility for plastic waste sorting and pretreatment 
• Supplies feedstock for advanced recycling 
• Focused on sustainable plastics circular economy 
• No direct quotes appear in this article."
Source One Plastics,http://www.source-one.net,https://www.plasticstoday.com/advanced-recycling/lyondellbasel-jv-launches-advanced-recycling-facility-in-germany,Joint Venture Launches Advanced Recycling Facility in Germany,2/26/2024,Plastics Today,"• New plant in Eicklingen, Germany processes 70,000 metric tons of plastic annually 
• Uses energy-efficient dry-processing sorting system 
• Quote: 'This marks another important milestone…' — Yvonne van der Laan, LyondellBasell EVP 
• Quote: 'With the Source One Plastics plant… inaugurating another ecologically attractive solution' — Kai Hoyer"
Source One Plastics,http://www.source-one.net,https://www.recyclingtoday.com/tag/mixed-plastics/,Freepoint Eco-Systems and Source One Announce Pretreatment Collaboration,12/15/2023,Recycling Today,"• Collaboration to develop pretreatment infrastructure across Europe 
• Aims to enhance sorting and recycling of mixed plastics 
• Strengthens supply chain for circular plastics 
• No direct quotes appear in this article."
Westec Plastics Corporation,http://www.westecplastics.com,https://www.tctmagazine.com/additive-manufacturing-3d-printing-industry-insights/latest-additive-manufacturing-3d-printing-industry-insights/making-time-how-westec-plastics-is-reducing-toolmaking-lead-times-with-mantles-trueshape-technology/,Making Time: How Westec Plastics is reducing toolmaking lead times with Mantle’s TrueShape,12/12/2023,TCT Magazine,"• Adopted Mantle TrueShape metal AM to reduce toolmaking lead times and EDM 
• “We’re able to print the most complicated part of the job,” — Tammy Barras, President 
• “With 3D printing, so many more fine features can be ‘roughed’ in …,” — Travis Meeks, VP of Tooling"
Westec Plastics Corporation,http://www.westecplastics.com,https://www.plasticstoday.com/medical/westec-plastics-first-medical-molder-to-acquire-game-changing-metal-printer,Westec Plastics first medical molder to acquire game‑changing metal printer,8/3/2023,PlasticsToday,"• Reports first production Mantle P‑200 metal AM deployment at Westec 
• Accelerates prototype and production steel tooling for medical customers 
• No direct quotes appear in this article"
Westec Plastics Corporation,http://www.westecplastics.com,https://www.moldmakingtechnology.com/news/westec-plastics-3d-prints-mold-inserts-using-trueshape-technology,Westec Plastics 3D prints mold inserts using TrueShape technology,3/10/2023,MoldMaking Technology,"• Notes production of H13 inserts via Mantle for qualification and production 
• Benefits include speed, complexity handling, reduced EDM 
• No direct quotes appear in this article"
PTA Plastics (PTA Corp.),http://www.ptaplastics.com,https://www.plasticsnews.com/news/pta-plastics-adds-equipment-medical-molding-reshoring,"PTA Plastics adds equipment for medical molding, reshoring",1/8/2021,Plastics News,"• Invested $2M in smart presses across Oxford CT and Longmont CO 
• Supports reshoring‑driven demand in medical markets 
• No direct quotes appear in this article"
PTA Plastics (PTA Corp.),http://www.ptaplastics.com,https://www.plasticstoday.com/medical/pta-plastics-makes-2-million-capital-investment-to-meet-medical-molding-demand,PTA Plastics makes $2 million capital investment to meet medical molding demand,1/7/2021,PlasticsToday,"• Added four Wittmann Battenfeld and two Engel presses at two plants 
• Expansion aimed at meeting pandemic‑era medical demand surge 
• No direct quotes appear in this article"
"Ivanhoe Tool & Die Company, Inc.",http://ivanhoetool.com/,https://www.plasticsnews.com/article/19950529/NEWS/305299961/ivanhoe-tool-die-buys-500-ton-press,Ivanhoe Tool & Die buys 500‑ton press,5/29/1995,Plastics News,"• Purchase of 500‑ton Engel press customized for closures 
• Focus on closure molding and in‑house testing capability 
• No direct quotes appear in this article"
"Ivanhoe Tool & Die Company, Inc.",http://ivanhoetool.com/,https://www.plasticsnews.com/article/19960513/NEWS/305139957/ivanhoe-remains-true-to-roots-in-mold-design,Ivanhoe remains true to roots in mold design,5/13/1996,Plastics News,"• Profile emphasizes commitment to mold design expertise and training 
• “They may be good on a computer … but we need craftsmen,” — founder (Plastics News) 
• No photo caption noted"
"Ivanhoe Tool & Die Company, Inc.",http://ivanhoetool.com/,https://www.moldmakingtechnology.com/articles/ivanhoe-tool-die-building-a-brand,Ivanhoe Tool & Die: Building a Brand,4/1/2006,MoldMaking Technology,"• Branding around unscrewing and high‑cavitation molds 
• Reviews decades of growth and specialization in closures/packaging 
• No direct quotes appear in this article"
"WEPCO Plastics, Inc.",https://wepcoplastics.com/,https://hartfordbusiness.com/article/wepco-plastics-inc/,Wepco Plastics Inc.,10/20/2017,Hartford Business Journal,"• Local profile highlights on‑time delivery improvements 
• Focus on prototype and short‑to‑medium run molding services 
• No direct quotes appear in this article"
"WEPCO Plastics, Inc.",https://wepcoplastics.com/,https://www.cbia.com/news/workforce/wepco-plastics-advanced-manufacturing-grant/,Wepco Plastics awards $5K grant to advanced manufacturing program,11/5/2021,CBIA News,"• Reports $5,000 Trailblazer STEAM grant to Connecticut River Academy 
• Education partnership and sustainability‑focused student project 
• Photo: Grant presentation image on CBIA page"
"Westminster Tool, Inc.",http://www.westminstertool.com,https://www.moldmakingtechnology.com/news/westminster-tool-partners-with-sumitomo-shi-demag-to-add-mold-qualification-capacity,Westminster Tool partners with Sumitomo (SHI) Demag to add mold‑qualification capacity,1/28/2022,MoldMaking Technology,"• Adds 354T Sumitomo press for mold qualification and customer demos 
• Supports medical‑grade consistency and validation 
• No direct quotes appear in this article"
"Westminster Tool, Inc.",http://www.westminstertool.com,https://www.plasticsnews.com/news/toolmaker-westminster-attracting-retaining-new-generation-manufacturers,Westminster Tool working to attract and retain new generation of manufacturers,2/27/2024,Plastics News,"• Reports workforce development strategies: career fairs, student engagement, awareness campaigns 
• Highlights cultural/technical transformation efforts 
• No direct quotes appear in this article"
Ameritech Die & Mold,https://www.amdiemold.com/,https://www.amdiemold.com/about-us,Ameritech Die & Mold Company History,1/1/2023,Official Website,"• Founded in 1985 by Ronald Wozny, Richard Wozny, and Steven Rotman 
• Grew from Michigan and Ohio operations to Mooresville, NC headquarters 
• Developed lean CNC-based manufacturing systems 
• No direct quotes appear in this profile."
Ameritech Die & Mold,https://www.amdiemold.com/,https://www.amdiemoldsouth.com/,Ameritech South Expansion,6/1/2009,Ameritech South Website,"• Expanded to Florida by acquiring Pinnacle Mold assets 
• Achieved AS9100B quality certification 
• Serves aerospace and military sectors 
• No direct quotes appear in this profile."
Ameritech Die & Mold,https://www.amdiemold.com/,https://www.amdiemold.com/about-us/video-virtual-tour,Ameritech Virtual Tour,1/1/2023,Official Website,"• Known for precision tooling and molds for high-risk automotive parts 
• Produces molds for airbag covers requiring extreme accuracy 
• Offers facility tour highlighting modern tooling equipment 
• No direct quotes appear in this tour."
"American Tool & Mold, Inc.",http://www.atemold.com,https://www.eeoc.gov/newsroom/eeoc-wins-summary-judgment-american-tool-mold-disability-case,EEOC wins summary judgment in American Tool & Mold disability case,4/21/2014,U.S. EEOC,"• Federal court finds ATM violated disability discrimination law by withdrawing job offer over old back injury 
• Order cites unlawful use of post‑offer medical exam results 
• No direct quotes appear in this article"
"Iowa Mold & Engineering, Inc.",http://www.iowamold.com,https://www.kcrg.com/content/news/Made-in-Eastern-Iowa-Plastics-from-Belle-Plaine-to-the-world-437631943.html,Made in Eastern Iowa: Plastics from Belle Plaine to the world,7/31/2017,KCRG-TV9,"• Local TV feature on growth, automation and facility expansion at Belle Plaine IA shop 
• Continuous equipment additions and process upgrades since the 1990s 
• Photo: KCRG shows the shop’s expanded space and equipment"
MSI Mold Builders,http://www.msimoldbuilders.com,https://www.thegazette.com/news/cedar-rapids-mold-company-donates-ear-savers-for-mask-wearers/,Cedar Rapids mold company donates ‘ear savers’ for mask wearers,5/26/2020,The Gazette,"• Designed and donated 50,000 plastic 'ear savers' to relieve mask pressure for healthcare workers during COVID‑19 
• Mold design‑to‑production completed in under a week; 400 units/hour vs. slow 3D printing 
• “This was our opportunity to help… frontlines… ” — Roger Klouda, President"
MSI Mold Builders,http://www.msimoldbuilders.com,https://www.plasticsnews.com/news/msi-mold-builders-leads-effort-make-donate-50000-ear-savers,"MSI Mold Builders leads effort to make, donate 50,000 ear savers",6/8/2020,Plastics News,"• Partnered with Kelly Plastics Inc. to mass‑produce ear savers for healthcare workers 
• Reinforces rapid response and community support 
• No direct quotes appear in this article"
MSI Mold Builders,http://www.msimoldbuilders.com,https://www.plasticsnews.com/article/20150330/NEWS/150339991/msi-mold-builders-expands-in-iowa-eyes-automotive-market,"MSI Mold Builders completes 12,000 sq‑ft expansion, eyes automotive market",3/30/2015,Plastics News,"• Added 12,000 sq ft to Cedar Rapids plant; upgraded 5‑axis machining and 3,000‑ton injection press 
• “We want to be a mold maker that does automotive work, rather than an automotive mold maker,” — Roger Klouda"
MSI Mold Builders,http://www.msimoldbuilders.com,https://www.thegazette.com/news/employers-struggle-with-worker-shortage/,Employers struggle with worker shortage,6/26/2016,The Gazette,"• Recruiting challenge for CNC operators; pays full tuition for interns via Kirkwood program 
• “We will pay 100 percent… if you work for us as an intern…” — Roger Klouda"
"Summit Mold, Inc.",http://www.summitmold.com,https://www.moldmakingtechnology.com/articles/summit-mold-better-not-bigger,Summit Mold: Better Not Bigger,2/1/2004,MoldMaking Technology,"• Lean operations and disciplined growth 
• Complex tooling capability and on‑time delivery 
• No direct quotes appear in this article"
A&C Mold,http://www.acmold.com,http://www.acmold.com,A&C Mold Expands Equipment Capabilities,8/1/2012,Official Website,"• Expanded production floor capacity 
• Added six new machines to broaden portfolio 
• Equipment page offers details on each new addition 
• No direct quotes appear in this article."
A-1 Tool Corporation,http://www.a1toolcorp.com,https://www.vfpress.news/articles/business/county-gives-tax-breaks-to-natl-cycle-in-maywood-a-1-tool-in-melrose-park/,"County Gives Tax Breaks To Nat’l Cycle In Maywood, A-1 Tool In Melrose Park",10/20/2018,Village Free Press,"• Local coverage of Cook County incentives supporting industrial employers including A‑1 Tool 
• Summarizes expected economic impact for Proviso Township 
• No direct quotes appear in this article"
Alchemy Precision,http://www.alchemyprecision.com,https://alchemyprecision.com/,Alchemy Precision Company Profile,1/1/2023,Official Website,"• Formerly DMC Mold & Tool Corp, based in Cary, IL 
• Specializes in precision injection, insert molding, micro molds, and Class 101 tooling 
• Serves industries including medical, electronics, consumer, and automotive 
• Provides EDM, CNC, grinding, CMM inspection, and contract machining services 
• No direct quotes appear in this profile."
Angle Tool Works,http://www.angletoolworks.com,https://www.angletoolworks.com/,Angle Tool Works Company Profile,1/1/2023,Official Website,"• Founded in 1961, specializes in thermoform and plastic tooling 
• ISO 9001:2015 certified with a global presence 
• Expanded partnerships in North America, Latin America, and Europe 
• Established European service partnership with dexterMT in 2016 
• No direct quotes appear in this profile."
Armin Tool & Manufacturing Co.,http://www.armin-ind.com,https://www.tmaillinois.org/uploads/1/3/1/0/131011131/2016_feb.pdf,TMA News: Manufacturers invest in paid apprenticeships,3/3/2016,Technology & Manufacturing Association News,"• Newsletter highlights apprenticeship program introducing trainees to mold disassembly and types of molds in first 30 days 
• Pathway to skilled moldmaking roles in South Elgin, IL 
• No direct quotes appear in this article"
"B A Die Mold, Inc.",http://www.badassmolds.com,https://www.moldmakingtechnology.com/news/b-a-die-mold-inc-celebrates-55-years-in-moldmaking,B A Die Mold Inc. Celebrates 55 Years in Moldmaking,10/11/2023,MoldMaking Technology,"• Illinois mold builder marks 55th anniversary; focus on complex precision tooling 
• Highlights innovation and regulated‑market experience 
• No direct quotes appear in this article"
"B A Die Mold, Inc.",http://www.badassmolds.com,https://www.plasticstoday.com/injection-molding/b-a-die-mold-celebrates-50-years-building-badass-molds-for-intricate-plastic-parts,B A Die Mold celebrates 50 years building ‘badass’ molds for intricate plastic parts,4/30/2018,PlasticsToday,"• Specializes in complex threaded and unscrewing molds with in‑house sampling 
• Markets include medical device, water filtration, automotive and caps/closures 
• No direct quotes appear in this article"
"Chicago Mold Engineering Co., Inc.",http://www.chicagomold.com,https://www.moldmakingtechnology.com/articles/chicago-mold-engineering-in-the-spotlight,Chicago Mold Engineering: In The Spotlight,1/1/2007,MoldMaking Technology,"• Profile of Chicago Mold highlighting multi-shot molding and stack mold capabilities  
• Includes focus on reverse-engineering services and heritage in precision moldmaking  
• No direct quotes appear in this article."
Comet Die & Engineering,http://www.cometdie.com,https://www.cometdie.com/,Comet Die & Engineering Company Profile,1/1/2023,Company Website,"• Provides precision tooling and die engineering services  
• Known for design and manufacturing in automotive and industrial sectors  
• Summary based on official company profile  
• No direct quotes appear in this profile."
Craftsman Tool & Mold Company,http://www.craftsmanmold.com,https://americanmoldbuilder.com/index.php/2019/09/17/customized-software-spurs-shipping-efficiency-at-craftsman-tool-a-mold/,Customized Software Spurs Shipping Efficiency at Craftsman Tool & Mold,9/17/2019,The American Mold Builder,"• Customized logistics/shipping software improved on‑time performance 
• Tracking and automation tactics improved throughput and customer communication 
• No direct quotes appear in this article"
Creative Die Mold Corp.,http://www.creativediemold.com,https://www.moldmakingtechnology.com/news/creative-blow-mold-tooling-acquires-isbm-business-from-big-3-precision-mold,Creative Blow Mold Tooling Acquires ISBM Business from Big 3 Precision Mold,5/7/2025,MoldMaking Technology,"• Illinois-based Creative expanded by acquiring Big 3’s ISBM division 
• Retained skilled workforce and intellectual property 
• Strengthens blow mold tooling capabilities 
• No direct quotes appear in this article."
DEMGY Group (US coverage not verified),http://www.demgy.com,,No news,,,No news
Elba Tool,http://www.elbatool.com,https://www.elbalighting.com/elba-nominated-for-the-stellantis-supplier-of-the-year-2024-award/,ELBA Nominated for the Stellantis Supplier of the Year 2024 Award,4/15/2024,Elba Official Site,"• Recognized by Stellantis for quality and innovation in automotive tooling 
• Highlights operational excellence and supplier partnerships 
• No direct quotes appear in this article."
InjectionMoldMaking.com / Electroform,http://www.injectionmoldmaking.com,https://www.injectionmoldmaking.com/PlasticsNewsArticle%20062606.pdf,"Electroform mixes toolmaking, automation",6/26/2006,Plastics News,"• Electroform showcased integration of tooling with automation at NPE 
• Demonstrated two-shot molding, in-mold decorating, and automated assembly 
• Quote: “We’ve done this to show what technology can do.” — Wade Clark, President"
Foreman Tool & Mold Corp.,http://www.foremantool.com,https://www.plasticsnews.com/article/20190117/NEWS/190119904/illinois-molder-adds-two-kraussmaffei-machines,Illinois molder adds two KraussMaffei machines,1/17/2019,Plastics News,"• Capacity boost supports two-shot molding and growing programs 
• Investment underscores automation and higher-cavitation work 
• No direct quotes appear in this article"
"Helm Tool Co., Inc.",http://www.helmtool.com,https://www.plasticsnews.com/news/helm-tool-imt-under-one-roof-13m-investment,"Helm Tool, IMT under one roof with $13M investment",8/30/2022,Plastics News,"• Consolidation brings Helm Tool and Intermolding Technology under one renovated roof in Franklin Park, IL 
• Project adds sampling/testing capacity and positions for growth 
• No direct quotes appear in this article"
Industrial Molds (Pyramid Molding Group),http://www.industrialmolds.com,https://www.wifr.com/2021/01/20/at-more-than-50-years-rockford-manufacturer-rebrands/,"At more than 50 years, Rockford manufacturer rebrands",1/20/2021,WIFR-TV,"• Rebrand launches Pyramid Molding Group as parent over Industrial Molds and Pyramid Plastics 
• Local station quotes release on uniting under one brand to increase customer value 
• Photo: Company announcement imagery on WIFR page"
Industrial Molds (Pyramid Molding Group),http://www.industrialmolds.com,https://plasticsbusinessmag.com/enews/2021/pyramid-molding-group-debuts-as-parent-company-to-industrial-molds-and-pyramid-plastics/,Pyramid Molding Group debuts as parent company,2/3/2021,Plastics Business,"• Trade coverage confirms unified branding and updated logos/websites across the group 
• Positions combined molding and tooling offering under a single identity 
• No direct quotes appear in this article"
Industrial Molds (Pyramid Molding Group),http://www.industrialmolds.com,https://www.moldmakingtechnology.com/news/pyramid-molding-group-expands-workforce-to-fuel-anticipated-growth,Pyramid Molding Group expands workforce to fuel anticipated growth,8/29/2023,MoldMaking Technology,"• Adds 21 team members since May 2023 across Pyramid Plastics and Industrial Molds 
• Expansion aligns with plan to enhance capabilities and customer service 
• No direct quotes appear in this article"
Janler Corporation,http://www.janler.com,https://www.plasticstoday.com/injection-molding/uniphase-acquires-mold-maker-janler,Uniphase Acquires Mold Maker Janler,10/30/2024,PlasticsToday,"• Uniphase acquires Chicago mold builder Janler to expand integrated engineering/tooling 
• Highlights Janler’s 70-year history and high-cavitation expertise 
• No direct quotes appear in this article"
Janler Corporation,http://www.janler.com,https://www.moldmakingtechnology.com/news/uniphase-acquires-janler-corp-to-expand-capabilities-in-plastics-injection-molding,Uniphase Acquires Janler Corp. to Expand Capabilities in Plastics Injection Molding,11/1/2024,MoldMaking Technology,"• Trade news confirms Oct 29, 2024 acquisition of Janler by Uniphase 
• Frames deal within broader plastics injection molding capability expansion 
• No direct quotes appear in this article"
Janler Corporation,http://www.janler.com,https://www.plasticsnews.com/news/uniphase-buys-chicago-tool-builder-janler,Uniphase buys Chicago tool builder Janler,11/15/2024,Plastics News,"• Third-party confirmation and additional context on the acquisition 
• Positions Uniphase + Janler as combined molder/toolmaker serving medical and consumer markets 
• No direct quotes appear in this article"
"Matrix Plastic Products, Inc.",http://www.matrixplastic.com,https://www.plasticsnews.com/mergers-acquisitions/plastics-industry-business-deals-including-mergers-and-acquisitions,Plastics industry business deals (Matrix Plastic Products entry),1/21/2025,Plastics News (M&A Tracker),"• Tracker notes private investment by 3 Boomerang Capital to accelerate Matrix growth and automation 
• Signals investor confidence in medical device tooling/molding niche 
• No direct quotes appear in this article"
"Pelco Tool & Mold, Inc.",http://www.pelcotoolinc.com,https://www.plasticsnews.com/article/20170810/NEWS/170819993/illinois-toolmaker-pelco-upgrades-equipment,Illinois toolmaker Pelco upgrades equipment,8/10/2017,Plastics News,"• Reports approximately $2M in equipment upgrades at Glendale Heights, IL operation 
• Focused on speed, quality and capacity for precision molds 
• No direct quotes appear in this article"
"Pelco Tool & Mold, Inc.",http://www.pelcotoolinc.com,https://www.plasticsnews.com/article/20150911/NEWS/150919984/pelco-brink-to-work-together-on-complex-molds-iml-systems,"Pelco, Brink to work together on complex molds, IML systems",9/11/2015,Plastics News,"• Cooperation agreement with Brink for thin-wall packaging molds and IML systems 
• Strategic push into packaging tooling technology 
• No direct quotes appear in this article"
PM Mold Company,http://www.pmmold.com,https://www.plasticsnews.com/mergers-acquisitions/acquisition-platform-newco-buys-pm-mold,Acquisition platform NewCo buys PM Mold,9/22/2022,Plastics News,"• NewCo Plastics acquires PM Mold Co. under White Wolf Capital platform 
• Deal expands tooling/molding reach in Illinois market 
• No direct quotes appear in this article"
Tri‑Par Die & Mold Corporation,http://www.tri-par.com,https://www.moldmakingtechnology.com/news/the-amba-chicago-chapter-recognizes-top-apprentices,The AMBA Chicago Chapter Recognizes Top Apprentices,1/8/2019,MoldMaking Technology,"• Chicago-area apprentices recognized by AMBA Chicago Chapter; Tri‑Par among participating employers 
• Coverage highlights workforce development within moldmaking community 
• No direct quotes appear in this article"
"Decatur Mold Tool & Engineering, Inc.",http://www.decaturmold.com,https://www.plasticsnews.com/news/decatur-mold-invests-12m-lights-out-technology,Decatur Mold invests $12M in lights-out technology,10/17/2022,Plastics News,"• Adds 14,000+ sq‑ft expansion and automation for lights‑out machining in North Vernon, IN 
• Supports faster tool builds and reshoring initiatives 
• No direct quotes appear in this article"
"Decatur Mold Tool & Engineering, Inc.",http://www.decaturmold.com,https://www.rubbernews.com/expansion/decatur-mold-invests-12m-lights-out-technology,Decatur Mold invests $12 million in lights-out technology,10/18/2022,Rubber News,"• Trade follow-up covers five new 5‑axis machines and automation 
• Frames investment within post‑pandemic reshoring and capacity needs 
• No direct quotes appear in this article"
"Roembke Manufacturing & Design, Inc.",http://www.roembke.com,https://www.rubbernews.com/article/20150317/NEWS/303099974/mold-maker-roembke-reveals-recipe-for-success,Mold maker Roembke reveals recipe for success,3/17/2015,Rubber News,"• Indiana LSR mold builder invests $1M+ to expand capabilities; diversification beyond automotive 
• Highlights tooling complexity, growth plans and market mix 
• No direct quotes appear in this article"
"Roembke Manufacturing & Design, Inc.",http://www.roembke.com,https://www.rubbernews.com/article/20160527/NEWS/305169990/family-run-business-roembke-mfg-design-inc,Family-run business: Roembke Mfg. & Design Inc.,5/27/2016,Rubber News,"• Follow-up feature on operations and market positioning for LSR molds 
• Notes North American leadership in rubber industry tooling niche 
• No direct quotes appear in this article"
ASH Industries,http://www.ashindustries.com,https://www.plasticsnews.com/news/injection-molder-ash-industries-expanding-louisiana,Injection molder ASH Industries expanding in Louisiana,7/22/2022,Plastics News,"• $5M expansion to double manufacturing space in Lafayette Parish and add 85 jobs 
• Growth tied to medical/industrial programs; mentions LED partners 
• No direct quotes appear in this article"
ASH Industries,http://www.ashindustries.com,https://www.opportunitylouisiana.gov/news/ash-industries-announces-85-job-expansion-in-lafayette,ASH Industries Announces 85-Job Expansion In Lafayette,7/13/2022,Louisiana Economic Development (LED),"• Official state release confirms 20,000‑sq‑ft addition and incentives 
• Quote: “The expansion of ASH Industries is an important job creation project …” — Gov. John Bel Edwards"
"Accu‑Die & Mold, Inc.",http://www.accu-die.com,https://www.moodyonthemarket.com/new-president-announced-at-accu-die-mold-in-stevensville/,New president announced at Accu‑Die & Mold in Stevensville,2/1/2024,Moody on the Market,"• Founder Daniel Reifschneider names Dan Lausch as new president; founder remains CEO 
• Local coverage of succession aimed at growth and continuity 
• Quote: “I’m getting older and it’s time … to put somebody else in charge,” — Daniel J. Reifschneider"
Commercial Tool Group (Commercial Tool & Die),http://www.commercialtoolgroup.com,https://www.moldmakingtechnology.com/news/zimmermann-designs-custom-milling-machines-for-commercial-tool-die,Zimmermann designs custom milling machines for Commercial Tool & Die,9/1/2021,MoldMaking Technology,"• Three custom portal milling machines designed to speed production and improve accuracy at CTD in Comstock Park, MI 
• Highlights collaboration to tailor five-axis capabilities for large plastic injection molds 
• No direct quotes appear in this article"
Die‑Tech & Engineering,http://www.dietech-gr.com,https://blogs.sw.siemens.com/nx-design/crisis-engineering-die-tech-engineering-joins-the-race-for-ventilators-in-the-coronavirus-pandemic/,Crisis engineering: Die‑Tech & Engineering joins the race for ventilators,4/21/2020,Siemens (NX Design blog),"• Case study shows rapid mold design/build for GM/ventilator program under Defense Production Act 
• Outlines CAD/CAM workflow enabling days‑to‑production turnaround 
• No direct quotes appear in this article"
Die‑Tech & Engineering,http://www.dietech-gr.com,https://www.ideastream.org/news/2020-05-20/how-his-small-factory-got-drafted-into-crafting-a-key-component-for-ventilators,How his small factory got drafted into crafting a key component for ventilators,5/20/2020,Ideastream Public Media,"• Public media piece documents rapid collaboration with Twin City Die Castings for GM/Ventec ventilators 
• Local angle on mobilizing moldmakers for pandemic response 
• No direct quotes appear in this article"
"North American Lighting, Inc. (NAL)",http://www.nal.com,https://www.indianapolisrecorder.com/north-american-lighting-continues-growth-in-indiana/,North American Lighting continues growth in Indiana,3/10/2023,Indianapolis Recorder,"• Regional outlet notes expansion of Indiana operations adding jobs and capacity 
• Offers context around tooling and supply partnerships in region 
• No direct quotes appear in this article"
General Die & Engineering,http://www.gendie.com,https://artiflexmfg.com/2024/09/24/artiflex-acquires-general-die-and-engineering/,ArtiFlex acquires General Die & Engineering,9/24/2024,ArtiFlex Manufacturing,"• ArtiCast Tool & Manufacturing (ArtiFlex family) acquires Grand Rapids-based General Die & Engineering 
• Highlights GD&E expertise in large high-pressure die-cast dies and injection molds 
• No direct quotes appear in this article"
"Liberty Molds, Inc.",http://www.libertymolds.com,https://www.moldmakingtechnology.com/articles/michigan-moldmaker-produces-tools-onshore-and-off,Michigan Moldmaker Produces Tools Onshore and Off,8/12/2020,MoldMaking Technology,"• Profile details dual onshore/offshore tooling strategy across China and Portage, MI 
• Covers complex injection tool builds and competitiveness approach 
• No direct quotes appear in this article"
Midwest Die Corporation,http://www.midwestdiecorp.net,https://www.moodyonthemarket.com/barodas-midwest-die-corp-sold-by-founding-nitz-family/,Baroda’s Midwest Die Corp Sold by Founding Nitz Family,10/27/2021,Moody on the Market,"• Local outlet reports sale of Midwest Die Corp to Lateral Industries, LLC 
• Founders Rodney and Richard Nitz exit ownership; operations to continue 
• No direct quotes appear in this article"
Midwest Die Corporation,http://www.midwestdiecorp.net,https://www.caldergr.com/midwest-die-corp-acquired-by-lateral-industries-llc/,"Midwest Die, Corp. of Baroda, MI Acquired by Lateral Industries, LLC",10/27/2021,Calder Capital,"• Advisor note confirms acquisition and buyer details 
• States company will continue operating as Midwest Die Corp 
• No direct quotes appear in this article"
"Model Die & Mold, Inc.",http://www.modeldie.com,https://www.moldmakingtechnology.com/articles/dive-into-3-different-mold-shops-with-me,Dive Into 3 Different Mold Shops With Me (includes Model Die & Mold),10/14/2024,MoldMaking Technology,"• Editorial mentions March 2023 shop visit with Model Die & Mold (Grand Rapids, MI) 
• Contextual insights into shop practices and learning takeaways 
• No direct quotes appear in this article"
"Quality Mold (Erie, PA)",http://www.quality-molds.com,https://www.moldmakingtechnology.com/articles/pennsylvania-mold-builder-doubles-footprint-maintains-quality-and-company-values-,"Pennsylvania Mold Builder Doubles Footprint, Maintains Quality and Company Values",4/7/2023,MoldMaking Technology,"• Feature on Erie-based Quality Mold’s footprint expansion while maintaining culture and quality 
• Covers investments and workflow improvements during growth 
• No direct quotes appear in this article"
Venture Global Engineering,http://www.ventureglobalengineering.com,https://thecountypress.mihomepaper.com/articles/venture-global-foundation-donates-20000-to-imlay-city-robotics-team/,"Venture Global Foundation donates $20,000 to Imlay City robotics team",11/28/2018,The County Press,"• Donation supports high school robotics team ‘Spartronics’ in Imlay City, MI 
• Reflects STEM pipeline and community engagement by company foundation 
• No direct quotes appear in this article"
Johnson Precision Mold & Engineering,https://www.johnsonmold.com/,https://wlkm.com/category/business/tax-tips/,City grants tax abatement to Johnson Precision Mold & Engineering,9/3/2013,"WLKM (Sturgis, MI)","• Local report notes 12-year tax abatement; investment in high-speed machining center 
• Located in North Centerville Road business park, Sturgis, MI 
• No direct quotes appear in this article"
Johnson Precision Mold & Engineering,https://www.johnsonmold.com/,https://www.michigan.gov/treasury/-/media/Project/Websites/treasury/BLGSS/PSD/Property-Tax-IFT-Certs/2014-STC-Certs/Certificates-4814.pdf,Industrial Facility Exemption Certificate 2013-523 (Johnson Precision Mold & Engineering),4/9/2014,Michigan State Tax Commission (PDF),"• State certificate documents IFT approval with personal property investment of $118,876 
• Confirms abatement issued April 8, 2014 for Sturgis, MI location 
• No direct quotes appear in this article"
"Concept Molds, Inc.",http://www.conceptmolds.com,https://www.plasticsnews.com/article/20140305/NEWS/140309959/medbio-adds-tooling-with-buy-of-concept-molds,Medbio adds tooling with buy of Concept Molds,3/5/2014,Plastics News,"• Medbio acquires Concept Molds in Schoolcraft MI to add in-house tooling 
• Article provides deal rationale and capabilities context 
• No direct quotes appear in this article"
"Concept Molds, Inc.",http://www.conceptmolds.com,https://medbiollc.com/medbio-acquires-local-mold-builder/,Medbio acquires local mold builder Concept Molds,2/10/2014,Medbio (official),"• Corporate release confirms acquisition of Concept Molds in Schoolcraft MI 
• Adds medical tooling capability to Grand Rapids based molder 
• Quote: “This partnership between Concept Molds and Medbio has been evolving for some time.” — Chris Williams, President and CEO, Medbio (Medbio)"
"Concept Molds, Inc.",http://www.conceptmolds.com,https://cascade-partners.com/transaction/concept-molds-has-been-acquired-by-medbio-inc/,"Concept Molds has been acquired by Medbio, Inc.",2/28/2014,Cascade Partners,"• Advisor note details Concept Molds capabilities and lights out operations 
• Confirms location Schoolcraft MI and transaction close in 2014 
• No direct quotes appear in this article"
"Legacy Precision Molds, Inc.",http://www.legacyprecisionmolds.com,https://www.moldmakingtechnology.com/articles/legacy-precision-molds-aims-for-ingenuity-in-every-job,Legacy Precision Molds Aims for Ingenuity in Every Job,4/1/2016,MoldMaking Technology,"• Feature profile covers shop practices and five axis machining adoption 
• Highlights Grandville MI location and complex injection tooling work 
• No direct quotes appear in this article"
"Legacy Precision Molds, Inc.",http://www.legacyprecisionmolds.com,https://www.plasticsnews.com/news/amba-honors-accedes-fox-united-tool-emerging-leader-vanderzwaag,AMBA honors tooling standouts; Emerging Leaders Rising Star from Legacy Precision,3/21/2024,Plastics News,"• AMBA recognizes Legacy Precision’s Nick VanderZwaag as Rising Star at 2024 conference 
• Article situates recognition within broader industry awards coverage 
• No direct quotes appear in this article"
Maximum Mold Group,http://www.maximummoldgroup.com,https://www.moldmakingtechnology.com/articles/2018-leadtime-leader-award-winner-maximum-mold-group,2018 Leadtime Leader Award Winner: Maximum Mold Group,6/4/2018,MoldMaking Technology,"• MMT names Maximum Mold Group Leadtime Leader for strategy and diversification 
• Covers acquisitions and capabilities across Max brands 
• No direct quotes appear in this article"
Maximum Mold Group,http://www.maximummoldgroup.com,https://www.moodyonthemarket.com/passion-mission-drive-success-for-growing-maximum-mold-group-of-bh/,Passion and mission drive success for growing Maximum Mold Group of BH,9/5/2019,Moody on the Market,"• Local business outlet profiles growth of Maximum Mold and sister companies in Berrien County MI 
• Notes expansion into multiple facilities and services 
• No direct quotes appear in this article"
Maximum Mold Group,http://www.maximummoldgroup.com,https://www.gardnerweb.com/articles/mmt-chat-one-mold-builders-strategic-diversification-journey,MMT Chat: One Mold Builder’s Strategic Diversification Journey,8/26/2025,Gardner Business Media / MMT,"• Interview style piece discusses Maximum Mold Group evolution and multi facility structure 
• Provides industry context on diversification and strategy 
• No direct quotes appear in this article"
"Excelsior Tool, Inc.",http://www.excelsiortool.com,https://www.enterpriseminnesota.org/articles/fall-2022/in-search-of-stability/,In Search of Stability,8/25/2022,Enterprise Minnesota,"• Story details Excelsior Tool’s ISO certification to stabilize post COVID operations 
• Maps recovery steps for Maple Plain MN mold builder 
• Quote: “That was a very hard year, the worst year we ever had,” — Bob Bush, Owner, Excelsior Tool (Enterprise Minnesota)"
"Excelsior Tool, Inc.",http://www.excelsiortool.com,https://www.nist.gov/mep/successstories/2024/worth-investment,Worth the Investment,2/21/2025,NIST MEP,"• MEP success story explains ISO 9001 project with Enterprise Minnesota for Excelsior Tool 
• Notes impact on retaining key customers and handling demand increases 
• Quote: “Getting our ISO system set up was a lot of work and everybody was involved. Now that it’s up and running, it has been worth the investment.” — Excelsior Tool leadership (NIST MEP)"
"H & S Mold, Inc.",http://www.hs-mold.biz,https://www.discovernortheastmichigan.org/article.asp?ait=nv&nid=212,H&S Mold utilizes Skilled Trade Training Funds to implement ERP training,1/30/2017,Discover Northeast Michigan / Michigan Works!,"• Local workforce program awards $10,072 to train eight H&S Mold employees on new ERP system 
• Coverage emphasizes workforce development and competitiveness in Gaylord MI 
• Quote: “With the training I have received, I can proficiently use the ERP software program, as well as train and assist fellow employees.” — Ashley Bergman, Office Manager, H & S Mold (Discover Northeast Michigan)"
Elite Mold & Engineering,http://teameliteonline.com,https://www.teameliteonline.com/news/page/2/?et_blog=,Elite Wins 2023 Best of MichBusiness Award,12/1/2023,Official Website,"• Recognized as one of Michigan’s finest manufacturers 
• Winner in Manufacturing Marvels category 
• No direct quotes appear in this article."
Elite Mold & Engineering,http://teameliteonline.com,https://www.teameliteonline.com/about-us/,Elite Named a Top Mold Maker in North America,6/1/2023,Plastics News (via Official Website),"• Listed among North America’s top mold makers 
• Recognized for manufacturing excellence 
• No direct quotes appear in this article."
Elite Mold & Engineering,http://teameliteonline.com,https://www.teameliteonline.com/elite-installs-high-speed-all-electric-shibaura-injection-molding-machine/,Elite Installs High-Speed All-Electric Shibaura Injection Molding Machine,10/15/2022,Official Website,"• Installed Shibaura EC85SXIII injection molding machine 
• Features include 5-point toggle, real-time strain gauge, grease-free tie bars 
• Enhances speed, precision, and reduces maintenance 
• No direct quotes appear in this article."
Elite Mold & Engineering,http://teameliteonline.com,https://www.teameliteonline.com/tackling-the-unique-challenges-in-aerospace-injection-molding-services,Tackling Aerospace Injection Molding Challenges,8/1/2021,Official Website,"• Explains how Elite meets precision and rapid turnaround needs in aerospace 
• Utilizes ISO 9001:2015 certification and ITAR registration 
• Focused on low-volume injection molding 
• No direct quotes appear in this article."
Elite Mold & Engineering,http://teameliteonline.com,https://www.teameliteonline.com/the-advantages-of-partnering-with-a-low-volume-injection-molding-specialist,The Advantages of Low-Volume Injection Molding,5/1/2021,Official Website,"• Describes benefits of low-volume injection molding 
• Faster turnaround, reduced tooling cost, and prototype flexibility 
• Ideal for rapid product development 
• No direct quotes appear in this article."
Elite Mold & Engineering,http://teameliteonline.com,https://www.thomasnet.com/company/elite-mold-engineering-inc-969717/profile,Thomasnet Business Profile,1/1/2023,Thomasnet,"• Shelby Township, MI-based precision mold maker 
• Offers 3- and 5-axis CNC machining, injection molding, EDM, additive manufacturing 
• ITAR registered; serves aerospace, automotive, and medical industries 
• No direct quotes appear in this profile."
Mo‑Tech Corporation,http://www.mo-tech.com,,No news,,,No news
"Mold Craft, Inc. (now part of Westfall Technik)",http://www.mold-craft.com,https://www.plasticsnews.com/article/20190118/NEWS/190119879/westfall-adds-micro-mold-tooling-with-mold-craft-acquisition,Westfall adds micro-mold tooling with Mold Craft acquisition,1/18/2019,Plastics News,"• Acquisition bolsters Westfall’s micromolding/tooling for medical devices 
• Covers technology scope and rationale for the deal 
• No direct quotes appear in this article"
"Mold Craft, Inc. (now part of Westfall Technik)",http://www.mold-craft.com,https://westfalltechnik.com/westfall-technik-acquires-mold-craft/,Westfall Technik Acquires Mold Craft,1/18/2019,Westfall Technik (official),"• Official confirmation of acquisition and positioning within Westfall platform 
• Notes micro‑sized parts and high‑cavitation tool expertise 
• No direct quotes appear in this article"
Select Tool (Canada),http://www.select-tool.com,https://windsorstar.com/business/local-business/select-tool-expands-operations-in-windsor-essex,Select Tool expands operations in Windsor-Essex,9/5/2019,Windsor Star,"• Expansion adds space and jobs in Windsor‑Essex; automation/tooling firm 
• Industry mix includes automotive and industrial customers 
• No direct quotes appear in this article"
Action Mold & Machining,http://www.actionmold.net,https://www.moldmakingtechnology.com/news/action-mold-machining-expands-capabilities-with-new-equipment,Action Mold & Machining expands capabilities with new equipment,7/15/2019,MoldMaking Technology,"• New machining equipment increases throughput and precision 
• Signals ongoing investment and continuous improvement 
• No direct quotes appear in this article"
TK Mold & Engineering,http://www.tkmoldeng.com,https://www.moldmakingtechnology.com/news/tk-mold-engineering-expands-apprenticeship-pipeline,TK Mold & Engineering expands apprenticeship pipeline,10/22/2018,MoldMaking Technology,"• Structured apprenticeship to address skills gap 
• Partnerships with local schools highlighted 
• No direct quotes appear in this article"
Viking Tool & Engineering,http://www.vikingtooleng.com,https://www.moldmakingtechnology.com/articles/shop-profile-viking-tool-engineering,Shop Profile: Viking Tool & Engineering,6/1/2006,MoldMaking Technology,"• Profile notes complex tooling expertise and customer collaboration 
• Discusses technology adoption and project management discipline 
• No direct quotes appear in this article"
Team Elite Online,http://teameliteonline.com,,No news,,,No news
HS Mold,http://www.hs-mold.biz,,No news,,,No news
Legacy Precision Molds,http://www.legacyprecisionmolds.com,,No news,,,No news
"MC Molds, Inc.",http://www.mcmolds.com,https://www.moldmakingtechnology.com/articles/mmt-chat-bottle-expertise-gives-way-to-test-kit-work,MMT Chats: Bottle Expertise Gives Way to Test Kit Work,7/21/2020,MoldMaking Technology,"• Focus: Shop pivoted from bottle expertise to COVID-19 test kit tooling work 
• Coverage: Trade publication profile with operational details 
• Local context: Williamston, Michigan 
• No direct quotes appear in this article."
Maximum Mold Group,http://www.maximummoldgroup.com,https://www.moldmakingtechnology.com/articles/mmt-chat-one-mold-builders-strategic-diversification-journey,MMT Chat: One Mold Builder’s Strategic Diversification Journey,8/26/2025,MoldMaking Technology,"• Interview-style article tracing evolution from a single shop to a diversified enterprise 
• Highlights multi-facility structure and strategic diversification 
• No direct quotes appear in this article."
"Concept Molds, Inc.",http://www.conceptmolds.com,https://www.moldmakingtechnology.com/articles/technology-and-sourcing-guide-2023-mold-builders,Technology and Sourcing Guide 2023: Mold Builders,7/17/2023,MoldMaking Technology,"• Trade guide listing Concept Molds among top suppliers of precision molds 
• Covers industries including automotive, medical, and industrial markets 
• No direct quotes appear in this article."
Precision Mold USA,http://www.precisionmoldusa.com,,No news,,,No news
"Zero Tolerance, LLC",http://www.zerotolerancecnc.com,https://www.moldmakingtechnology.com/articles/small-agile-mold-builder-keeps-speed-and-accuracy-at-the-forefront,"Small, Agile Mold Builder Keeps Speed and Accuracy at the Forefront",11/7/2022,MoldMaking Technology,"• Team collaboration and advanced technology enable rapid design changes 
• Focus on speed and accuracy for moldmaking in Clinton Township, Michigan 
• No direct quotes appear in this article."
"B.M.E. Tool, Inc.",http://www.bmetool.biz,https://www.bmetool.biz/,"Company Profile: B.M.E. Tool, Inc.",11/4/2019,City of Lonsdale / Company Directory,"• Founded in 1998, family-owned by Vern and Paul Bongers 
• Precision tool and moldmaking operation in Lonsdale, Minnesota 
• Appears in local business directories confirming presence and activity 
• No direct quotes appear in this listing."
Mo-Tech Corporation,http://www.mo-tech.com,https://www.mo-tech.com/,Mo-Tech Company Profile,1/1/2023,Mo-Tech Official Website,"• Over 50 years of tooling expertise based in Oakdale, Minnesota 
• Provides full-service mold and die solutions with state-of-the-art equipment 
• Emphasis on customer-driven approach 
• No direct quotes appear in this profile."
R&D/Leverage Co.,http://www.rdleverage.com,https://www.plasticsnews.com/news/rdleverage-comes-k-under-new-management-big-plans,"R&D/Leverage comes to K with new owners, big plans",10/24/2022,Plastics News,"• Trade show report outlines post‑acquisition strategy and management plans 
• Highlights packaging tooling and product development services 
• No direct quotes appear in this article"
R&D/Leverage Co.,http://www.rdleverage.com,https://www.plasticsnews.com/news/engineering-students-take-look-rdleverage,Engineering students take a look at R&D/Leverage,10/14/2019,Plastics News,"• STEM outreach feature shows students touring Lee’s Summit facility 
• Emphasizes workforce pipeline initiatives and community engagement 
• No direct quotes appear in this article"
"Accede Mold & Tool Co., Inc.",https://accedemold.com,https://accedemold.com/precision-laser-2024-supplier-of-the-year/,Accede announces Precision Laser Technology as 2024 Supplier of the Year,12/1/2024,Accede Mold & Tool (official),"• Recognizes Precision Laser Technology for supplier excellence in Rochester, NY 
• Announces launch of Supplier of the Year program in 2025 
• No direct quotes appear in this article"
"Accede Mold & Tool Co., Inc.",https://accedemold.com,https://accedemold.com/recent-news/page/2/,Mitchell Fox promoted to Manufacturing Specialty Dept. Manager,1/17/2024,Accede Mold & Tool (official),"• Promotion reflects growth in specialty manufacturing and leadership bench 
• Internal advancement cited as part of operations strategy 
• No direct quotes appear in this article"
"Tolerance Tool, LLC",http://www.tolerancetool.com,https://www.moldmakingtechnology.com/news/tolerance-tool-is-acquired-by-beanstalk-collaborative-community-wealth,Tolerance Tool is acquired by Beanstalk Collaborative Community Wealth,12/10/2021,MoldMaking Technology,"• Ownership transition to employee‑centric investment firm BCCW (St. Paul, MN) 
• Acquisition date noted as Dec 9, 2021 with focus on long‑term growth 
• No direct quotes appear in this article"
Thal Precision (Natech Plastics division),http://www.thalprecision.com,https://www.rubbernews.com/article/20180618/NEWS/180619939/mold-makers-we-re-in-uncharted-territory-on-tariffs,Mold makers: 'We’re in uncharted territory' on tariffs,6/18/2018,Rubber News,"• Industry round‑up includes perspective from Thal Precision on tariff impacts 
• Quote: “We’re in uncharted territory,” — Paul Thal, General Manager, Thal Precision (Rubber News)"
The Minco Group,http://www.mincogroup.com,https://www.ptonline.com/blog/post/the-minco-group-becomes-spis-first-zero-net-waste-company-,The Minco Group becomes SPI’s first Zero Net Waste company,8/10/2016,Plastics Technology (blog),"• Recognition under SPI’s Zero Net Waste program for Dayton, OH manufacturer 
• Highlights sustainability initiatives across tooling and molding operations 
• No direct quotes appear in this article"
The Minco Group,http://www.mincogroup.com,https://www.plasticsnews.com/news/industry-opens-doors-minds-mfg-day,"Industry opens doors, minds for MFG Day",10/4/2024,Plastics News,"• Notes Minco Group participation in Manufacturing Day outreach 
• Context on community engagement and workforce development 
• No direct quotes appear in this article"
"Rapid Mold Solutions, Inc.",http://www.rapidmoldsolutions.com,https://www.prnewswire.com/news-releases/adler-industrial-solutions-acquires-rapid-mold-solutions-301417367.html,Adler Industrial Solutions acquires Rapid Mold Solutions,11/8/2021,PR Newswire,"• Acquisition expands Adler’s capabilities in western Pennsylvania 
• Confirms continued focus on rapid prototyping and short‑run production 
• No direct quotes appear in this article"
"Rapid Mold Solutions, Inc.",http://www.rapidmoldsolutions.com,https://mbsadvisors.com/deals/rapid-mold-solutions-acquired/,Rapid Mold Solutions acquired,11/15/2021,MBS Advisors (deal note),"• Advisory note provides additional transaction context and regional strategy 
• Mentions prior Shorts Tool & Mfg. acquisition in Pennsylvania 
• No direct quotes appear in this article"
Prism Plastics (Meadville),http://www.prismplastics.com/meadville,https://www.prismplastics.com/wp-content/uploads/Plastics-News_acquistion.pdf,Prism Plastics acquires Tech Molded Plastics (Meadville),6/27/2016,Plastics News (PDF reprint),"• Acquisition nearly doubles company size and adds Meadville, PA plant 
• Supports precision automotive components manufacturing footprint 
• No direct quotes appear in this article"
Tessy Tooling (Tessy Plastics),https://www.tessytooling.com,https://tessy.com/news-events/tessy-2025-sustained-excellence-award/,Tessy Plastics Wins 2025 Sustained Excellence Award,3/24/2025,Plastics News,"• Award for innovation and sustained excellence in plastics manufacturing 
• Highlights vertical integration and medical molding expertise 
• No direct quotes appear in this article"
Tessy Tooling (Tessy Plastics),https://www.tessytooling.com,https://tessy.com/news-events/complex-molding-tasks-give-tessy-a-chance-to-shine/,Complex molding tasks give Tessy a chance to shine,2/15/2025,Rubber News,"• Coverage of high-tech medical molding showcased at IME West Show 
• Describes advanced automation and cleanroom operations 
• No direct quotes appear in this article"
"JMMS, Inc.",http://www.jmmsinc.com,https://www.jmmsinc.com/blog/category/company-news/,JMMS joins forces with Moldetipo Group to expand global automotive market,5/31/2016,JMMS Company Blog,"• Partnership expands reach into automotive tooling 
• Growth ambition toward global markets documented 
• No direct quotes appear in this article"
"JMMS, Inc.",http://www.jmmsinc.com,https://www.plasticsnews.com/article/20090706/NEWS/307069960/toolmaker-jmms-revving-up-auto-work,Toolmaker JMMS revving up auto work,7/6/2009,Plastics News,"• Reports $1.8M in equipment investment over 16 months 
• Expansion targeted at automotive market opportunities 
• No direct quotes appear in this article"
Dynacast,http://www.dynacast.com,https://www.prnewswire.com/news-releases/dynacast-finalizes-signicast-acquisition-300432563.html,Dynacast Finalizes Signicast Acquisition,4/3/2017,PR Newswire,"• Dynacast acquired Signicast expanding to 9,500 employees across 27 locations 
• Quote: “Given Signicast's complementary manufacturing technology…” — Simon Newman, CEO"
Dynacast,http://www.dynacast.com,https://www.prnewswire.com/news-releases/partners-group-to-acquire-dynacast-a-leading-global-manufacturer-of-precision-engineered-components-300011056.html,Partners Group to Acquire Dynacast,12/17/2014,PR Newswire,"• Partners Group acquired controlling stake in Dynacast for ~$1.1B 
• Quote: “Dynacast has a long and rich history… With the investment led by Partners Group…” — Simon Newman, CEO"
Dynacast,http://www.dynacast.com,https://www.mpo-mag.com/dynacast-expands-mim-capability-with-purchase-of-k/,Dynacast Expands MIM Capability with Purchase of Kinetics Climax Inc.,11/1/2016,MPO Magazine,"• Acquisition strengthens Dynacast’s MIM capabilities 
• Quote: “This acquisition establishes Dynacast … as a front-runner in the growing MIM market.” — Simon Newman, CEO"
"Innovation Mold & Design, Inc.",http://www.innovationmold.com,https://www.benchmarkintl.com/insights/benchmark-international-successfully-facilitated-the-transaction-between-innovation-mold-and-design-inc-and-halifax-west/,"Benchmark International Facilitated Transaction Between Innovation Mold & Design, Inc. and Halifax West",2/4/2025,Benchmark International,"• Partnership with Halifax West via M&A guidance from Benchmark International 
• Quote: “Partnering with Halifax West was a natural fit for us...” — Alex Hermann, President"
Company Name,Company Website URL,News Story URL,Headline,Publication Date,Publisher or Source,GPT Summary
Dynamic Tool Corporation,http://www.dyntool.com,https://www.dyntool.com/news,Dynamic relocates molding machines to Development Center,3/1/2025,Dynamic Tool Official Site,"• Relocated 22–900 ton injection molding machines to Development Center 
• Supports customer press validation and process development 
• No direct quotes appear in this update."
Dynamic Tool Corporation,http://www.dyntool.com,https://www.moldmakingtechnology.com/articles/new-product-development-best-practices,New Product Development Best Practices (Editorial Series),1/15/2025,MoldMaking Technology,"• Two-part editorial authored by Dynamic Tool leaders 
• Provides insights on best practices in product development 
• No direct quotes appear in this article."
M&M Tool and Mold,http://www.mmtoolandmold.com,https://www.moldmakingtechnology.com/articles/2012-leadtime-leader-awards-mm-tool-and-mold-niche-manufacturing-sustains-profitability,2012 Leadtime Leader Award Winner: M&M Tool and Mold,6/1/2012,MoldMaking Technology,"• Recognized as 2012 Leadtime Leader for resilience during recession 
• Focused on niche manufacturing strategy called Lite Leadtime 
• No direct quotes appear in this article."
M&M Tool and Mold,http://www.mmtoolandmold.com,https://mmtoolandmold.com/blog,Adding Value Through Reverse Engineering,4/6/2022,M&M Tool Blog,"• Highlights collaborative culture and value creation through reverse engineering 
• Customer-focused process improvements 
• No direct quotes appear in this blog."
Master Tool & Mold,http://www.mastertoolandmold.com,https://www.mastertoolandmold.com,Master Tool & Mold Company Profile,1/1/2023,Company Website,"• Family-owned business established in 1972 
• Specializes in multi-cavity and die casting molds 
• Offers repair and engineering services 
• No direct quotes appear in this profile."
Mauston Tool Corporation,https://www.maustontool.com/,https://www.maustontool.com/about-us,Mauston Tool Company Profile,1/1/2023,Company Website,"• Founded in 1978, invested in robotics and lights-out manufacturing 
• Includes customer testimonials praising quality and accuracy 
• No direct quotes appear in this profile."
Mauston Tool Corporation,https://www.maustontool.com/,https://www.plasticstoday.com,RJG Certification Milestone,6/1/2003,Plastics Today,"• Mauston became first firm to complete RJG moldmaking and tryout certification 
• Recognized in plastics industry trade press 
• No direct quotes appear in this article."
Omega Tool Corp,http://www.omega-tool.com,https://omegatoolcorp.com/omega-tool-corp-named-a-new-winner-of-canadas-best-managed-companies-2024,Omega Tool Corp Named Winner of Canada’s Best Managed Companies 2024,5/1/2024,Omega Tool Corp / Deloitte Canada,"• Recognized for governance, innovation, and financial performance 
• Award presented under Deloitte Canada Best Managed program 
• Includes executive acknowledgment 
• No direct quotes appear in this article."
Omega Tool Corp,http://www.omega-tool.com,https://biztimes.com/omega-tool-buys-menomonee-falls-building-occupied-by-mgs,Omega Tool Buys Menomonee Falls Building Occupied by MGS,7/16/2024,BizTimes,"• Purchased $2.8M facility in Menomonee Falls, WI 
• Strengthens North American manufacturing footprint 
• No direct quotes appear in this article."
Retlaw Industries,http://www.retlawindustries.com,https://www.retlawindustries.com/,Retlaw Industries Company Profile,1/1/2023,Official Website,"• Manufacturer of idler pulleys and custom injection molded components 
• ISO 9001:2015 certified facility in Hartland, Wisconsin 
• Emphasis on design, tooling, and assembly services 
• No direct quotes appear in this profile."
Sheridan Mold,http://www.sheridanmold.com,,No news,,,No news
Snider Mold Company,http://www.snidermold.com,https://huskregistrars.com/congratulations-to-the-team-at-snider-mold-company-inc-located-in-mequon-wi/,Snider Mold Achieves ISO 9001 Re-Certification,3/4/2024,Husk Registrars,"• Snider Mold successfully completed ISO 9001 re-certification 
• Recognized for capabilities in injection and compression moldmaking 
• Local context: Mequon, Wisconsin 
• No direct quotes appear in this article."
Stellar Mold & Tool,http://www.stellarmold.com,https://www.plasticsnews.com/news/stellar-mold-tool-gets-new-breath-life-new-owner,Stellar Mold & Tool Gets New Breath of Life with New Owner,9/1/2020,Plastics News,"• Galesville-based Stellar Mold revitalized under new ownership by Jason Lawton 
• Article highlights renewed strategy and investments in tooling capacity 
• Quote: 'We are excited to take Stellar Mold to new levels of performance.' — Jason Lawton, Owner"
Triangle Tool Corp,http://www.triangletoolcorp.com,https://www.moldmakingtechnology.com/articles/high-technology-diversified-mold-builder-has-its-eye-on-improvement,High-Technology Diversified Mold Builder Has Its Eye on Improvement,9/15/2023,MoldMaking Technology,"• Triangle Tool focuses on diversification and advanced mold-building technologies 
• Emphasis on continuous improvement and customer-focused strategy 
• No direct quotes appear in this article."
Triangle Tool Corp,http://www.triangletoolcorp.com,https://www.plasticstoday.com/injection-molding/triangle-tool-corp-takes-home-moldmaking-honors,Triangle Tool Corp Takes Home Moldmaking Honors,5/18/2010,Plastics Today,"• Triangle Tool recognized for excellence in moldmaking for large industrial parts 
• Article notes employee skill as central to success 
• Quote: 'It’s really about the dedication of our people.' — Triangle Tool President"
"United Tool & Mold, Inc.",http://www.utminc.com,https://upstatebusinessjournal.com/manufacturing/united-tool-and-mold-inc-to-expand-with-11m-facility-in-pickens-county/,United Tool and Mold Inc. to expand with $11M facility in Pickens County,3/23/2018,Upstate Business Journal,"• Construction of a 60,000 sq ft facility to expand capacity 
• Strengthens mold service capabilities in Pickens County 
• Quote: 'This expansion is a testament... commitment to excellence on a global scale.' — H. Scott Phipps, President"
Prairie Tool Company,http://www.prairietool.net,https://prairietool.net/,Prairie Tool Company Profile,1/1/2023,Official Website,"• Founded 1989 with 12,000 sq ft facility 
• Provides CAD/CAM tooling across multiple industries 
• No direct quotes appear in this profile."
Prairie Tool Company,http://www.prairietool.net,https://www.plasticsnews.com/article/19990426/NEWS/304269945/quantum-rakes-in-new-business,Quantum rakes in new business,4/26/1999,Plastics News,"• Notes Quantum was started by Neil Bellikka of Prairie Tool & Mold 
• Highlights business growth and industry influence 
• No direct quotes appear in this article."
Integrity Tool & Mold,http://www.integritytn.com,https://www.plasticsnews.com/news/century-mold-buys-integrity-tools-injection-molding-division,Century Mold acquires Integrity’s injection molding division,4/12/2024,Plastics News,"• Century Mold acquired Integrity’s Pulaski, TN molding division 
• Expands high-tonnage molding capabilities 
• No direct quotes appear in this article."
Integrity Tool & Mold,http://www.integritytn.com,https://manufacturing-today.com/news/by-focusing-on-innovation-integrity-tennessee-is-broadening-its-capabilities-to-better-serve-clients/,Integrity Tennessee broadens capabilities,5/3/2023,Manufacturing Today,"• Highlights innovation and lean design approach 
• Expands engineering capabilities and client services 
• No direct quotes appear in this article."
Moldesign,http://www.moldesign.com,,No news,,,No news
Detail Mold & Manufacturing,http://www.detailmold.com,https://www.detailmold.com/about,Detail Mold Company Profile,1/1/2023,Official Website,"• Specializes in solving challenging mold design requirements 
• Emphasis on quality and trusted client relationships 
• Quote: 'One of the key factors for our success is solving challenging design requirements...' — Dan Berg, Company Leadership"
Lowrance Machine Shop,http://www.lowrancemachine.com,https://www.lowrancemachine.com/,ISO 9001:2015 Certified Family-Owned Shop,1/1/2023,Official Website,"• Third-generation, ISO 9001:2015-certified mold and machining business 
• 60+ years in Houston, specializing in custom molds and precision machining 
• No direct quotes appear in this profile."
"Schaefer Mold, Inc.",http://www.schaefermold.com,https://www.schaefermold.com/,Company Profile,1/1/2023,Official Website,"• Provides mold and tooling services 
• No third-party coverage identified 
• No direct quotes appear in this profile."
Solution Tools Mold & Die,http://www.solution-tools.com,https://www.moldmakingtechnology.com/products/solution-tools-mold-die-delivers-high-quality-components-for-plastic-injection-molds,Solution Tools Delivers High-Quality Components for Plastic Injection Molds,7/1/2021,MoldMaking Technology,"• Produces high-quality mold components for plastic injection 
• Capabilities include design, machining, plating, and consulting 
• No direct quotes appear in this article."
SEL Inc.,http://www.selinc.com,https://selinc.com/company/news/schweitzer-engineering-laboratories-to-produce-medical-device-for-autism-detection/,SEL to Produce Medical Device for Autism Detection,1/15/2025,SEL News,"• Announces autism detection device initiative 
• Led by Principal Scientist Dr. Georgina Lynch 
• No direct quotes appear in this article."
SEL Inc.,http://www.selinc.com,https://selinc.com/company/news/2024-index-of-freedom/,SEL Releases 2024 Index of Freedom,8/1/2024,SEL News,"• Launches ranking of business climates across U.S. states 
• Aligns with company’s expansion priorities 
• No direct quotes appear in this article."
"A.J. Tool & Manufacturing, LLC",http://www.ajtoolmfg.com,https://www.moldmakingtechnology.com/articles/aj-tool-co-inc-niche-moldmaking-meets-high-expectations,A.J. Tool Co. Inc.: Niche Moldmaking Meets High Expectations,2/1/2006,MoldMaking Technology,"• Profile of A.J. Tool highlighting small-team-driven quality 
• Successful niche moldmaking operation 
• No direct quotes appear in this article."
"A.J. Tool & Manufacturing, LLC",http://www.ajtoolmfg.com,https://ajtoolmfg.com/,Company Profile,1/1/2023,Official Website,"• Wisconsin-based mold design and build specialist with 40+ years of history 
• Offers fast and competitively priced injection mold solutions 
• No direct quotes appear in this profile."
"Apollo Tool, Inc.",http://www.apollo-tool.com,https://www.plasticsnews.com/blog/mold-makers-steer-toward-steady-growth-newest-ranking-data,Apollo Tool Rises in Mold Maker Rankings,10/18/2021,Plastics News,"• Apollo Tool moved up 18 spots in national mold maker rankings 
• Highlights growth and strong performance in U.S. toolmaking industry 
• No direct quotes appear in this article."
Carlson Tool & Manufacturing,http://www.carlsontool.com,https://carlsontool.com/category/carlson-news/,Carlson Tool Installs New High-Precision Grinder,7/16/2021,Carlson Tool News,"• Installed Kent KPG 1524 surface grinder for precision tooling 
• Investment improves efficiency and accuracy for large projects 
• No direct quotes appear in this news update."
Carlson Tool & Manufacturing,http://www.carlsontool.com,https://carlsontool.com/report-moldmakers-in-high-demand-across-the-u-s/,Moldmakers in High Demand Across U.S.,3/23/2018,Carlson Tool Report,"• Workforce grew by 13% with plans to expand another 20% 
• Reflects high industry demand for skilled moldmakers 
• No direct quotes appear in this report."
CDM Tool & Manufacturing,http://www.cdmtool.com,https://biztimes.com/cdm-tool-sold-to-jacsten-holdings/,CDM Tool Sells to Jacsten Holdings,4/21/2015,BizTimes,"• CDM Tool acquired by Jacsten Holdings LLC 
• Leadership retained, employees and community focus emphasized 
• Quote: 'This was a thoughtful decision to secure the future of the company.' — Company Founder"
CDM Tool & Manufacturing,http://www.cdmtool.com,https://www.moldmakingtechnology.com/news/amba-presents-mold-builder-of-the-year-tooling-trailblazer-of-the-year-awards,CDM Tool Receives AMBA Tooling Trailblazer Award,5/13/2022,MoldMaking Technology,"• Recognized by American Mold Builders Association for innovation 
• Award presented alongside Mold Builder of the Year 
• No direct quotes appear in this article."
Classic Tool & Die,http://www.classtd.com,https://www.cimatron.com/en/customer-stories/innovative-die-solutions-classic-tool-and-cimatron,Classic Tool Boosts Productivity with Cimatron,2/1/2020,Cimatron,"• Adopted Cimatron CAD/CAM automation to streamline operations 
• Achieved 75% productivity increase 
• Quote: 'By virtualizing Cimatron, we've seen productivity increase by 75%.' — Adriano Oppio, VP"
"Compumold Tool & Design, Inc.",http://www.compumold.com,https://milwaukeemakerspace.org/2020/04/we-are-almost-ready-to-make-a-lot-of-face-shields/,Compumold Produces PPE Molds During COVID-19,4/10/2020,Milwaukee Makerspace,"• Delivered injection mold for face shields in under a week 
• Supported PPE production for local hospitals 
• Quote: 'Compumold was able to get our mold done in less than a week.' — Milwaukee Makerspace Project Lead"
D & S Mold & Tool Company,http://www.dsmold.com,https://www.dsmold.com/history.html,D & S Mold Company History,1/1/2023,Official Website,"• Founded in 1944, relocated to Marinette, WI 
• Offers full-service mold design, building, and maintenance 
• Team has 300+ years combined tooling experience 
• No direct quotes appear in this profile."
"Marion Tool & Die, Inc. (Marion Manufacturing)",https://mariontool.com,https://www.war.gov/News/Contracts/Contract/Article/2646965/,"Contracts for June 4, 2021",6/4/2021,U.S. Department of Defense,"Headline: Contracts for June 4, 2021
Publisher: U.S. Department of Defense
Date: 2021-06-04
Marion Manufacturing (West Terre Haute, IN) awarded part of a $24,960,614 IDIQ contract alongside Augustine Die & Mold to provide machined items for naval maintenance and modernization
Work split: 50% West Terre Haute, IN; 50% Somerset, PA; completion expected June 2026
No direct quotes appear in this article."
"Marion Tool & Die, Inc. (Marion Manufacturing)",https://mariontool.com,https://www.927therock.com/2024/10/22/marion-manufacturing-merging-illinois-location-into-west-t-location/,Marion Manufacturing merging Illinois location into West Terre Haute location,10/22/2024,WTHI 92.7 The Rock,"Headline: Marion Manufacturing merging Illinois location into West Terre Haute location
Publisher: WTHI 92.7 The Rock
Date: 2024-10-22
Company to consolidate Morton, IL operations into West Terre Haute facility; focuses on CNC-machined components for heavy equipment, aerospace, and defense
No direct quotes appear in this article."
Meyer Tool,https://mayertool.com,https://www.journal-news.com/news/division-of-meyer-tool-moving-to-fairfield-headquarters-to-stay-in-cincy/RLMX4D77A5BXTI2NWDJVQGJIXU/,Division of Meyer Tool moving to Fairfield; headquarters to stay in Cincy,6/10/2025,Journal-News,"Headline: Division of Meyer Tool moving to Fairfield; headquarters to stay in Cincy
Publisher: Journal-News
Date: 2025-06-10
Company relocating MRO division to a 70,000-sq.-ft. leased space at 575 Quality Blvd., Fairfield; HQ and other operations remain in Camp Washington, Cincinnati; GE cited as a major client
No direct quotes appear in this article."
Meyer Tool,https://mayertool.com,https://www.cincymagazine.com/a-manufacturing-city/,A Manufacturing City,10/30/2023,Cincy Magazine,"Headline: A Manufacturing City
Publisher: Cincy Magazine
Date: 2023-10-30
Feature highlights Meyer Tool’s role in Camp Washington industrial corridor and local workforce
Quote: “Camp Washington is in our DNA,” said Beau Easton, chief financial officer, Meyer Tool — Cincy Magazine
No photo caption noted."
Advanced Tooling Inc,https://www.advancedtooling.com,https://www.wmc.org/programs-manufacturing-month/a-success-story-a-day-advanced-tooling-inc/,A Success Story A Day: Advanced Tooling Inc.,10/7/2014,Wisconsin Manufacturers & Commerce,"Headline: A Success Story A Day: Advanced Tooling Inc.
Publisher: Wisconsin Manufacturers & Commerce
Date: 2014-10-07
Located in Mount Calvary, Fond du Lac County, founded 1996
Manufactures small tools with diameters as small as 0.005 in; orders from 3 to 1,000 parts
Uses high-technology inspection equipment
Expanded facility to 12,000 sq ft in 2012 with $3.8M investment
Added machines in 2013, planned more for 2015
No direct quotes appear in this article."
"Matrix Tool, Inc.",https://www.matrixtoolinc.com,https://matrixtoolinc.com/news_post/supplier-performance-award-2024/,2024 Supplier Outstanding Performance Award,4/8/2025,"Matrix Tool, Inc.","Headline: 2024 Supplier Outstanding Performance Award
Publisher: Matrix Tool, Inc.
Date: 2025-04-08
Matrix Tool awarded its sixth consecutive Supplier Outstanding Performance Award from a long-standing, high-volume customer
No direct quotes appear in this article."
"Matrix Tool, Inc.",https://www.matrixtoolinc.com,https://matrixtoolinc.com/news/,Machine Investments Expand Molding Capacity for Continued Business Growth,8/12/2025,"Matrix Tool, Inc.","Headline: Machine Investments Expand Molding Capacity for Continued Business Growth
Publisher: Matrix Tool, Inc.
Date: 2025-08-12
Company added two new 60-ton Sodick-Plustech IMMs; nearly 50% of its 42 in-house machines are now high-precision fast-response IMMs
No direct quotes appear in this article."
Phoenix Tool & Molding,https://www.phoenixtoolco.com,https://peakstonegroup.com/peakstone-advises-phoenix-tool-mold-on-sale-to-oneida-molded-plastics/,Peakstone Advises Phoenix Tool & Mold on Sale to Oneida Molded Plastics,2023-08,Peakstone Group,"Headline: Peakstone Advises Phoenix Tool & Mold on Sale to Oneida Molded Plastics
Publisher: Peakstone Group
Date: 2023-08
Eric Bauerle, owner/CEO, said “We engaged Peakstone to find a partner who could build upon the unique capabilities that PTM has worked so hard to develop. PTM aligns well with Oneida’s manufacturing capabilities and culture.”
Also: “Peakstone conducted a very thorough process, and their advice, patience, and hard work helped us close a deal with Oneida and Cedar Ridge.”
Terms of transaction not disclosed."
Phoenix Tool & Molding,https://www.phoenixtoolco.com,https://www.intelligence360.news/elk-grove-village-illinois-based-phoenix-tool-molding-company-has-secured-480000-00-in-new-commercial-capital/,"Phoenix Tool & Molding secures $480,000 commercial capital for expansion",7/14/2021,Intelligence360 News,"Headline: Phoenix Tool & Molding secures $480,000 commercial capital for expansion
Publisher: Intelligence360 News
Date: 2021-07-14
Location: Elk Grove Village, IL
No direct quotes appear in this article."
Badie,https://www.badie.com,,No news,,,No news
Accu‑Mold,https://www.accu-moldinc.com,https://manufacturingtomorrow.com/news/2025/06/12/accumold-to-showcase-advanced-micro-molding-solutions-at-automatica-2025-in-munich/25169/,Accu‑Mold to Showcase Advanced Micro‑Molding Solutions at Automatica 2025 in Munich,6/12/2025,Manufacturing Tomorrow,"Headline: Accu‑Mold to Showcase Advanced Micro‑Molding Solutions at Automatica 2025 in Munich
Publisher: Manufacturing Tomorrow
Date: 2025-06-12
Accu‑Mold will demonstrate its expertise in producing high‑precision micro and small injection molded components at the show."
Accu‑Mold,https://www.accu-moldinc.com,https://tonkabayequity.com/news/tonka-bay-equity-partners-announces-investment-in-accumold/,Tonka Bay Equity Partners announces investment in Accu‑Mold,2025,Tonka Bay Equity Partners,"Headline: Tonka Bay Equity Partners announces investment in Accu‑Mold
Publisher: Tonka Bay Equity Partners
Date: 2025
Tonka Bay joined with current management, including CEO Roger Hargens, to recapitalize the company and provide capital for growth
Emphasizes Accu‑Mold’s proprietary micro‑mold technology for complex micro electronics, automotive, fiber optics, medical, and military applications."
Accu‑Mold,https://www.accu-moldinc.com,https://www.accu-mold.com/about-us/news/roger-hargens-and-accumold-honored-as-a-patriotic-employer,Roger Hargens and Accu‑Mold Honored as a Patriotic Employer,7/15/2025,Accu‑Mold,"Headline: Roger Hargens and Accu‑Mold Honored as a Patriotic Employer
Publisher: Accu‑Mold
Date: 2025-07-15
Accu‑Mold recognized by the Office of the Secretary of Defense for its contributions and standing
No direct quotes appear in this article."
Elite Mold & Engineering,https://elitemoldandengineering.com,https://www.tctmagazine.com/additive-manufacturing-3d-printing-news/elite-mold-and-engineering-partners-with-amfg-to-enhance-3d-printing-operations/,Elite Mold and Engineering partners with AMFG to enhance 3D printing operations,8/11/2023,TCT Magazine,"Headline: Elite Mold and Engineering partners with AMFG to enhance 3D printing operations
Publisher: TCT Magazine
Date: 2023-08-11
Elite chose AMFG’s MES software to support movement into additive manufacturing
CEO Paul Patrash said “We looked at several online quoting platforms, AMFG checked all the boxes for what we needed to support our growing customer base in the 3D additive market.”
AMFG’s Rohan Graham said “Allowing Elite to take a further step into the additive manufacturing space... fuels and promotes progress.”"
Elite Mold & Engineering,https://elitemoldandengineering.com,https://www.automationalley.com/2024/01/29/3d-printing-opens-up-new-manufacturing-options-for-elite-mold-engineering/,3D Printing Opens up New Manufacturing Options for Elite Mold & Engineering,1/29/2024,Automation Alley / Macomb County,"Headline: 3D Printing Opens up New Manufacturing Options for Elite Mold & Engineering
Publisher: Automation Alley / Macomb County
Date: 2024-01-29
Elite applied for and received an Industry 4.0 grant to purchase a DLS printer
$25,000 matching grant enabled a 280‑sq‑ft DLS printing facility, cutting lead‑times ~70% and costs ~50%
CEO Paul Patrash said “The county generously put it out there to help small businesses like ours to take the leap into the future with new technology.”
Also said Elite has been in business since 1982 doing injection molding and tooling."
Quist Mold,https://www.quistmold.com,,No news,,,No news
Dynamic Dies Inc.,https://www.dynamicdies.com,https://www.dynamicdies.com/company-news/,"Dynamic Dies Unveils North America’s First FujiFilm Acuity Ultra Hybrid LED Printer, Improving Small Run Capabilities for Box Houses",10/1/2024,Dynamic Dies,"Headline: Dynamic Dies Unveils North America’s First FujiFilm Acuity Ultra Hybrid LED Printer, Improving Small Run Capabilities for Box Houses
Publisher: Dynamic Dies
Date: 2024-10-01
The new hybrid LED printer enhances small-run print and die cutting work for corrugated packaging shops
No direct quotes appear in this article."
Dynamic Dies Inc.,https://www.dynamicdies.com,https://www.dynamicdies.com/dynamic-dies-expands-operations-with-new-facility-in-indianapolis/,Dynamic Dies Expands Operations With New Facility in Indianapolis,2/18/2025,Dynamic Dies,"Headline: Dynamic Dies Expands Operations With New Facility in Indianapolis
Publisher: Dynamic Dies
Date: 2025-02-18
New facility at 5811 W. Minnesota Street, Indianapolis, IN expands production & die cutting capacity
No direct quotes appear in this article."
Dynamic Dies Inc.,https://www.dynamicdies.com,https://www.dynamicdies.com/dynamic-dies-inc-announces-acquisition-of-allied-steel-rule-dies-inc-expanding-capabilities-and-establishing-fifth-location/,"Dynamic Dies Inc. Announces Acquisition of Allied Steel Rule Dies, Inc., Expanding Capabilities and Establishing Fifth Location",10/1/2024,Dynamic Dies,"Headline: Dynamic Dies Inc. Announces Acquisition of Allied Steel Rule Dies, Inc., Expanding Capabilities and Establishing Fifth Location
Publisher: Dynamic Dies
Date: 2024-10-01
Acquisition expands capability in steel-rule dies; fifth location established
No direct quotes appear in this article."
Dynamic Dies Inc.,https://www.dynamicdies.com,https://www.wtol.com/article/news/local/toledo-dynamic-dies-marvel-pizza-box-campaign/512-24f094d2-6c69-4893-a34d-1758755e33bd,Toledo’s Dynamic Dies helps with Marvel pizza box campaign,6/23/2025,WTOL / Local News,"Headline: Toledo’s Dynamic Dies helps with Marvel pizza box campaign
Publisher: WTOL / Local News
Date: 2025-06-23
Dynamic Dies created tooling for a national campaign with Little Caesars featuring Marvel’s Fantastic Four imagery
No direct quotes appear in this article."
Dura Mold,https://www.duramoldinc.com,https://www.moodyonthemarket.com/stevensville-manufacturer-investing-in-1-4m-expansion-with-seven-new-jobs/,Stevensville Manufacturer Investing in $1.4M Expansion With Seven New Jobs,11/30/2017,Moody on the Market,"Headline: Stevensville Manufacturer Investing in $1.4M Expansion With Seven New Jobs
Publisher: Moody on the Market
Date: 2017-11-30
Dura Mold making a $1.4M investment in an 8,000-sq-ft addition in Stevensville, Michigan; seven new jobs created
John Gast, Lake Charter Township Supervisor, said “When existing industry commits to expand… we applaud Lake Charter Township for their work.”
Frank Bock, President and co-owner, said “We are quite fortunate…” acknowledging local support."
Dynomax Inc.,https://www.dynomaxinc.com,https://www.chipestimate.com/Contract-Manufacturer-Dynomax-Inc-Achieves-Aerospace-and-Defense-AS9100-Rev-C-Quality‑Certification/Semiconductor‑IP‑Core/news/13817,Dynomax Inc Achieves Aerospace and Defense AS9100 Rev C Quality Certification,2011-09,ChipEstimate / Industry News,"Headline: Dynomax Inc Achieves Aerospace and Defense AS9100 Rev C Quality Certification
Publisher: ChipEstimate / Industry News
Date: September 2011
Dynomax earned AS9100 Revision C certification
Mike Martini, Quality Systems Director, said “The primary differences with Rev C include risk, project and configuration management, key process metrics, and expanded defense scope.”
Also noted Dynomax had earlier multi‑year agreements with Bombardier Learjet and B/E Aerospace."
Galaxy Tool Corp.,https://www.galaxytool.com,https://www.plasticstoday.com/plastics-processing/galaxy-tool-corp-expands-capability-and-capacity-as-it-revisits-its-plastics-heritage,Galaxy Tool Corp expands capability and capacity as it revisits its plastics heritage,8/8/2011,Plastics Today,"Headline: Galaxy Tool Corp expands capability and capacity as it revisits its plastics heritage
Publisher: Plastics Today
Date: 2011-08-08
Installed a Fidia 5‑axis CNC machining center (travels: 157in Y, 79in X, 55in Z) to boost large‑scale machining capacity
Added Tarus gun‑drill with bore travel up to 96in
Paul Maples, VP of BD, said “Galaxy continues to see a surge in demand… This machine allows shorter lead‑times while enhancing support and growth opportunities.”
Also said: “We’re seeing a lot of work come back from China as well.”"
Steel Craft,https://www.steelcrafttech.com,https://www.metalsminingreview.com/steel-craft,Steel Craft | Top Metal Working Services Company‑2024,2024,Metals & Mining Review,"Headline: Steel Craft | Top Metal Working Services Company‑2024
Publisher: Metals & Mining Review
Date: 2024
Steel Craft formed by merging several divisions into one unified brand. Offers full spectrum of metal fabrication services including high‑precision stamping and laser‑cutting
Kevin Stevick, President & CEO, said “Our mergers weren’t about just updating brand logos or business cards. It was about changing how we serve in the metal fabrication industry, as a one‑stop shop capable of handling a wide range of demands with expertise and efficiency.”"
Redline Plastics,https://www.redlineplastics.com,https://www.plasticsnews.com/news/redline-plastics-named-2024-plastics-news-processor-year,Redline Plastics Named 2024 Plastics News Processor of the Year,3/13/2025,Plastics News,"Headline: Redline Plastics Named 2024 Plastics News Processor of the Year
Publisher: Plastics News
Date: 2025-03-13
Redline Plastics (Manitowoc, WI) named Processor of the Year by Plastics News
Recognized for rotational molding, vacuum forming and other capabilities
Quote: “This award reflects the incredible work of our team … Winning Processor of the Year is validation of that effort …,” said Nick Murray, President — Plastics News
Quote: “From day one, our mission has been to be the best … this award proves … we’re not just striving — we’re achieving,” said Chuck Webster, CEO — Plastics News"
Universal Metal Products,https://www.universalmetalproducts.com,https://www.crainscleveland.com/manufacturing/technology-makes-universal-metal-products-more-efficient,Technology makes Universal Metal Products more efficient,5/26/2023,Crain’s Cleveland,"Headline: Technology makes Universal Metal Products more efficient
Publisher: Crain’s Cleveland
Date: 2023-05-26
Universal Metal finishes almost 1 million parts every year
Matt Rossman, director of manufacturing, noted the work is labor-intensive but technology continues improving efficiency
No further direct quotes appear in this article."
Manor Tool & Manufacturing,https://www.manortool.com,https://www.manortool.com/blog/angelo-simeone-tool-die-certification/,Manor Tool’s Newest Certified Tool & Die Maker: Angelo Simeone!,6/3/2021,Manor Tool Blog,"Headline: Manor Tool’s Newest Certified Tool & Die Maker: Angelo Simeone!
Publisher: Manor Tool & Manufacturing
Date: 2021-06-03
Angelo Simeone (grandson of founder, son of current president) joined the firm as tool & die maker; trained via the TMA apprenticeship program; brings CAD/MasterCam skills beyond traditional tool & die work."
"KMM Group, Ltd.",https://www.kmmgrp.com,https://kmmgrp.com/tag/press-releases/news-release-kmm-group-announces-final-construction-phase-of-100k-sq-ft-manufacturing-facility/,"KMM Group Announces Final Phase of 100,000 Sq Ft Manufacturing Facility",2/20/2023,KMM Group Press Release,"Headline: KMM Group Announces Final Phase of 100,000 Sq Ft Manufacturing Facility
Publisher: KMM Group, Ltd.
Date: 2023-02-20
KMM building out a new state-of-the-art 100,000 sq ft manufacturing facility in Hatboro, PA to support ultra-precision machining & grinding services."
Minth Group,https://www.minthgroup.com,https://www.investontario.ca/press-release/minth-group-builds-its-first-canadian-manufacturing-facility-windsor-ontario,"Minth Group builds its first Canadian manufacturing facility in Windsor, Ontario",4/3/2025,Invest Ontario,"Headline: Minth Group builds its first Canadian manufacturing facility in Windsor, Ontario
Publisher: Invest Ontario
Date: 2025-04-03
Invest Ontario supporting Minth’s nearly $300M investment in Windsor facility
Plant will produce exterior and structural auto parts including EV battery housings and plastic exterior parts
Project expected to create ~1,099 new jobs
William Chin, Chief Strategy Officer, said “Being a global company supporting global OEMs … Ontario is a very important and exciting new addition to our portfolio … especially with our Canadian roots.”"
Minth Group,https://www.minthgroup.com,https://windsornewstoday.ca/windsor/news/2025/08/05/minth-announces-partnership-with-aisin-to-launch-phase-2-of-manufacturing-facility,Minth announces partnership with AISIN to launch phase 2 of manufacturing facility,8/5/2025,Windsor News Today,"Headline: Minth announces partnership with AISIN to launch phase 2 of manufacturing facility
Publisher: Windsor News Today
Date: 2025-08-05
Phase two involves construction of a 150,000 sq ft facility, part of earlier $300M investment
Will further expand EV/auto part production
William Chin, Chief Strategy Officer, said “This signing celebrates the continued commitment of Minth to Canada … the combined resources … will provide a tremendous team …”"
HART Design & Manufacturing,https://www.hartprecision.com,https://hartdesign.com/industry-news/hart-design-manufacturing-unveils-new-crumblers-and-crumble-lines-for-high-efficiency-cheese-processing/,HART Design & Manufacturing Unveils New Crumblers And Crumble Lines For High‑Efficiency Cheese Processing,10/30/2024,HART Design & Manufacturing,"Headline: HART Design & Manufacturing Unveils New Crumblers And Crumble Lines For High‑Efficiency Cheese Processing
Publisher: HART Design & Manufacturing
Date: 2024-10-30
Company added advanced systems for cheese crumbling including infeed, crumbling, discharge, and anti‑caking features
CEO Timm Schaetz said “With these additions, we’re empowering cheese producers to maximize efficiency while maintaining the highest quality standards.”"
1 Source Design Ltd.,http://1-sourcedesign.com/,https://cknewstoday.ca/chatham/news/2020/04/23/wallaceburg-company-shields-healthcare-workers,Wallaceburg company shields healthcare workers,4/23/2020,CK News Today,"Headline — CK News Today (2020-04-23)\nDonated 25 plexiglass intubation shields; typical work is trim dies and plastic injection tooling; municipal Economic Development facilitated; project cost exceeded $22,000\n""""Our economic development officers used their contacts within [the] local industry and Spencer Pray was able to reach out to 1 Source which moved extremely quickly to get the specifications and begin the process."""" — Stuart McFadden, director of Economic Development, CK News Today\n""""We were thrilled with the response and that we were able to play a role to bring this together."""" — Stuart McFadden, director of Economic Development, CK News Today\n""""It isn’t easy to find plexiglass right now but we were able to search our suppliers and found one in Pennsylvania."""" — Graham Tomlinson, director of sales and engineering, CK News Today\n""""When we found out that there was a need, we had no idea that anyone would be generous enough to simply donate the devices. 1 Source went above and beyond on this one and we’re extremely grateful."""" — Darrin Canniff, Mayor of Chatham-Kent, CK News Today\nPhoto: Mayor Darrin Canniff (left); Keith Dramnitzke; Graham Tomlinson; Nick Shadd; April 22 2020; photo courtesy of the Municipality of Chatham-Kent"
Harris Precision Mold,http://www.hpmold.com,https://www.moldmakingtechnology.com/articles/share-and-share-alike-sharing-software-streamlines-daily-mold-operations,Sharing Software Streamlines Daily Mold Operations,10/1/2000,MoldMaking Technology,Headline — MoldMaking Technology (2000-10-01)\nTrade feature on software sharing and workflow; includes Harris Precision Mold of Tempe AZ among shops profiled\nNo direct quotes appear in this article.
M.R. Mold & Engineering,http://www.mrmold.com,https://www.ptonline.com/news/mr-mold-engineering-completes-move-to-larger-location,M.R. Mold & Engineering Completes Move to Larger Location,5/13/2020,Plastics Technology,Headline — Plastics Technology (2020-05-13)\nCompany moved to larger facility; new tech center includes six injection molding machines ranging 55–120 tons; capability for LSR and thermoplastics trials\nNo direct quotes appear in this article.
Prestige Mold Inc.,http://www.prestigemold.com,https://www.plasticstoday.com/automation/prestige-mold-invests-1-5m-in-facility-equipment-automation,"Prestige Mold invests $1.5M in facility, equipment, automation",1/10/2011,PlasticsToday,"Headline — PlasticsToday (2011-01-10)\nInvested more than $1.5M in 2010 to remodel production area; stand-alone 30,000 ft² building; 65 employees; added equipment includes Makino V33i; Mori Seiki lathe with live tooling; LNS bar feeder; Foba laser; robotic grinder workcell\nNo direct quotes appear in this article."
"South Coast Mold, Inc.",http://www.southcoastmold.com,https://www.moldmakingtechnology.com/articles/strategic-machining,Strategic Machining,8/1/2016,MoldMaking Technology,Headline — MoldMaking Technology (2016-08-01)\nFeature on optimizing complex contour cutting for investment casting molds; strategic machining focus.\nNo direct quotes appear in this article.
"South Coast Mold, Inc.",http://www.southcoastmold.com,https://www.moldmakingtechnology.com/articles/south-coast-mold-energy-efficiency-add-up-to-success,"South Coast Mold: Energy, Efficiency Add up to Success",12/6/2010,MoldMaking Technology,Headline — MoldMaking Technology (2010-12-06)\nTrade profile on energy management and efficiency initiatives; recognition tied to Energy Star efforts.\nNo direct quotes appear in this article.
Westec Plastics Corporation,http://www.westecplastics.com,https://www.tctmagazine.com/additive-manufacturing-3d-printing-news/making-time-how-westec-plastics-is-reducing-toolmaking-lead-times-with-mantles-trueshape-technology/,Making Time: How Westec Plastics is reducing toolmaking lead times with Mantle's TrueShape technology,12/12/2023,TCT Magazine,"Headline — TCT Magazine (2023-12-12)\nInterview on adopting Mantle TrueShape to reduce toolmaking lead times; focus on medical programs.\n""I was blown away by the quality of the inserts that we saw."" — Tammy Barras, President, TCT Magazine\n""We’re able to print the most complicated part of the job."" — Tammy Barras, President, TCT Magazine"
Westminster Tool,http://www.westminstertool.com,https://www.ctinsider.com/business/article/mfg-hall-fame-trumpf-ward-leonard-westminster-tool-21032854.php,"Westminster Tool, Ward Leonard, Trumpf are 2025 inductees into American Manufacturing Hall of Fame",9/14/2025,CTInsider,"Headline — CTInsider (2025-09-14)
Plainfield CT mold maker inducted in small manufacturer category; article highlights workforce pipeline; 40 employees; average tenure ~9 years; average age 37
""You have to have a value proposition for human capital… You’ve got to get people to know who you are, what you stand for and what you’re about… It’s really about hiring for character and training for skills, and making sure that you can deliver on your promise to employees."" — Ray Coombs, founder and president, CTInsider
""You know the company is invested in you, so you want to give back to the best of your ability. I enjoy coming in at 5 a.m. I enjoy my 10-hour days. I truly enjoy being here."" — Daryl Jackson, manufacturing manager, CTInsider
Photo: Ray Coombs stands on the shop floor at Westminster Tool’s Plainfield, Conn., facility on Sept. 10, 2025 (Hearst Connecticut Media)."
A1 Tool Corporation,http://www.a1toolcorp.com,https://www.plasticsnews.com/news/a1-opening-tool-repair-facility-milwaukee,A1 opening tool repair facility in Milwaukee,1/10/2023,Plastics News,"Headline — Plastics News (2023-01-10)
Melrose Park IL-based A1 Tool bought a 24,000-square-foot Milwaukee building to open a tool repair shop; expects to employ more than 30 when fully staffed
No direct quotes appear in this article."
PTA Plastics,https://www.ptaplastics.com/,https://patch.com/connecticut/westhaven/university-new-haven-partners-innovative-connecticut-manufacturers-launch,University of New Haven Partners with Innovative Connecticut Manufacturers to Launch Engineering Scholarship,9/17/2025,"Patch (West Haven, CT)","Headline — Patch (West Haven, CT) (2025-09-17)\nNew scholarship created with Microboard and PTA Plastics to support engineering and technology students; workforce pipeline focus\n""The collaboration with Microboard and PTA Plastics reflects exactly what we strive for in our corporate partnerships: meaningful engagement that benefits both students and the industries they will serve."" — Paul Lavoie; vice president of innovation and applied technology; University of New Haven; Patch\n""This partnership is more than just a scholarship—it’s a strategic investment in the future of advanced manufacturing. Microboard is proud to support students who will become the engineers and innovators of tomorrow."" — Nicole Russo; CEO; Microboard; Patch\n""Sponsoring an engineering scholarship at the University of New Haven is more than a gift—it’s an investment in the innovators who will shape our future. By supporting talented students, PTA hopes to help bridge the gap between academic potential and real-world impact. Together, PTA, Microboard, and the University of New Haven can empower the next generation of engineers to solve the challenges of tomorrow."" — Mike Rocheleau; executive vice president; PTA Plastics; Patch"
"Ivanhoe Tool & Die Company, Inc.",http://ivanhoetool.com/,https://www.ctpost.com/connecticut/article/killingly-ct-anti-trump-signs-removed-vulgar-21053325.php,"CT homeowner says he was fired over anti-Trump signs, removes profanity after backlash",9/17/2025,Connecticut Post,"Headline — Connecticut Post (2025-09-17)\nLocal report states a Killingly resident said he was fired from Ivanhoe Tool & Die Co. following controversy over signs; earliest on-page date used; Updated date appears on page\n""I have finally removed all of the naughty words as I promised various people I would do."" — Matthew Berube; Killingly resident and former employee; Connecticut Post\n""People around me were trying to get me fired, because they were unhappy with the things I had written and said and they felt that they were entitled to try to sabotage my job."" — Matthew Berube; Connecticut Post\n""It’s really quite a shame that the ‘right’ side of politics’ reaction ended up taking a highly productive liberal off of the payroll and is forcing me to now ask the State’s taxpayers to cover me while I try not to lose my home."" — Matthew Berube; Connecticut Post"
"Roembke Manufacturing & Design, Inc.",http://www.roembke.com,https://www.wellsedc.com/news/council-oks-5-million-tax-abatement-roembke-manufacturing-and-design,Council OKs $5 million tax abatement for Roembke Manufacturing and Design,4/14/2020,Wells County Economic Development,"Council OKs $5 million tax abatement for Roembke Manufacturing and Design — Wells County Economic Development (2020-04-14)
Nine-year abatement on $5M of equipment for Ossian Industrial Park facility; plan adds seven employees; payroll increase projected at $350,000; equipment list includes CNC machines; laser cutting; grinding; optical measuring; mold press equipment; and IT gear
No direct quotes appear in this article."
Summit Mold,http://www.summitmold.com,https://cdapress.com/news/2020/apr/26/one-lakeside-condo-building-eyes-july-5/,One Lakeside condo building eyes July completion date (includes: Summit Mold plans second building),4/26/2020,Coeur d'Alene Press,"One Lakeside condo building eyes July completion date — Coeur d'Alene Press (2020-04-26)
Local business column notes Summit Mold will build a second manufacturing building at 4300 W. Seltice Way in Post Falls; company uses robotics; serves medical programs including ventilators; 18 employees; founded 1997
No direct quotes appear in this article.
Photo: Courtesy photo Company president Ron Finnicum shows two of the molds created by Summitt Mold."
"Dynamic Group, Inc.",http://www.dynamicgroup.com,https://www.mddionline.com/manufacturing/minnesota-based-medical-manufacturer-rebrands,Minnesota-Based Medical Manufacturer Rebrands,8/1/2025,MD+DI (Medical Device & Diagnostic Industry),"Minnesota-Based Medical Manufacturer Rebrands — MD+DI (2025-08-01)
Ramsey, MN-based Dynamic Group debuts new brand identity and website to better communicate value as contract manufacturing resource for medical and industrial customers
""Our industries are evolving—and so are we. We are building a more professional and nimble organization that is capable of meeting and exceeding customer expectations. This transformation reflects our commitment to stay ahead of the curve, deliver exceptional results, and position ourselves as leaders in every market we serve."" — Joe McGillivray, CEO, MD+DI"
"Mold Craft, Inc.",http://www.mold-craft.com,https://www.plasticsnews.com/news/first-half-roundup-packaging-deals-among-largest-so-far-2019,First-half roundup: Packaging deals among the largest so far in 2019 (includes Westfall Technik acquiring Mold Craft),7/16/2019,Plastics News,"Headline — Plastics News (2019-07-16)
Trade roundup notes Westfall Technik acquired Mold Craft, adding a precision micro-mold maker to its portfolio
No direct quotes appear in this article."
Franchino Mold & Engineering Company,http://www.franchino.com,https://www.plasticstoday.com/injection-molding/huge-aluminum-molds-completed-by-franchino,Huge aluminum molds completed by Franchino,6/4/2012,PlasticsToday,"Headline — PlasticsToday (2012-06-04)
Article reports three of the largest production aluminum molds completed by Franchino; largest at 300,000 lb with 50-drop hot manifold and 176 lb shot weight
""these were the largest they’d ever been requested to make."" — Todd Phillips; VP of sales & engineering; citing Vista Metals and Clinton Aluminum; PlasticsToday
""We build die-cast dies; we took that philosophy with these big aluminum production molds."" — Todd Phillips; VP of sales & engineering; ""We’ve got aluminum tools in the field that we built several years ago that now have two million shots on them."" — Todd Phillips; PlasticsToday"
"Decatur Mold Tool & Engineering, Inc.",http://www.decaturmold.com,https://jenningsedc.com/decatur-mold-tool-engineering-inc-expansion-announced/,"Decatur Mold Tool & Engineering, Inc. Expansion Announced",4/19/2022,Jennings County Economic Development Commission,"• Headline: Decatur Mold Tool & Engineering, Inc. Expansion Announced | Publisher: Jennings County Economic Development Commission | Date: 2022-04-19
• Adds 10,000 sq. ft. to house 3 robotic cells; ~$3M project; Force Construction to break ground in early May 2022
• Equipment: 2 large-capacity mills, 1 medium-capacity mill, 1 five-axis graphite mill, 1 EDM (Makino); robotics by FANUC and Erowa
• Aims to compete with low-cost countries; supports reshoring; projected revenue growth over 10 years; jobs for North Vernon area
• Staffing: +2–4 jobs in year one; project completion targeted for May 2023; additional hiring over next 3 years
• Training investments include Moldflow, injection mold design, CNC/high-speed machining, Mastercam, WorkNC, EDM, Lean
• Incentives: $150K IEDC EDGE tax credits; county approved 10‑yr real property and personal property tax abatements
• No direct quotes appear in this article."
Industrial Molds,http://www.industrialmolds.com,https://www.plasticstoday.com/injection-molding/molding-a-successful-family-business-50-years-on,"Molding a successful family business, 50 years on",12/14/2017,PlasticsToday,"• Headline: Molding a successful family business, 50 years on | Publisher: PlasticsToday | Date: 2017-12-14
• Profile of Industrial Molds Group (Rockford, IL) at its 50‑year milestone; third generation active in the company
• Quote (Andrew Peterson, Production Manager; source: PlasticsToday): ""I'm more aggressive in the things I want to achieve because for me there's lots of time.""
• Quote (Andrew Peterson; source: PlasticsToday): ""Being part of the family and the business means I get to do more than just the job description.""
• Quote (Tim Peterson, VP; source: PlasticsToday): ""If you have the last name of the ownership, you're held to a higher level of responsibility."""
Paragon D&E,http://www.paragonde.com,https://www.reliableplant.com/Read/21325/paragon-d_e-installs-largest-milling-machine-of-its-kind-in-world,Paragon D&E installs largest milling machine of its kind in the world,4/1/2009,Reliable Plant (Noria Corp.),"• Headline: Paragon D&E installs largest milling machine of its kind in the world | Publisher: Reliable Plant (Noria Corp.) | Date: 2009-04-01
• Installed double‑gantry 5‑axis FIDIA; ~60 ft x 12 ft table; ~$3.5M investment; supports aerospace/defense/automotive/nuclear work
• Quote (David Muir, President; source: Reliable Plant): ""Our new FIDIA milling machine represents a significant leap forward for Paragon D&E as we supply industries that demand highly precise molds and machined parts that are also very large.""
• Quote (David Muir; source: Reliable Plant): ""The capabilities of the FIDIA will allow us to fabricate very large parts and molds with very sophisticated shapes."""
Paragon D&E,http://www.paragonde.com,https://paragonde.com/nac-international-nuclear-packaging/,Paragon D&E and NAC International Forge Strategic Teaming Agreement to Expand Nuclear Packaging Solutions,5/15/2025,Paragon D&E (News),"• Headline: Paragon D&E and NAC International Forge Strategic Teaming Agreement to Expand Nuclear Packaging Solutions | Publisher: Paragon D&E (News) | Date: 2025-05-15
• Paragon and NAC to jointly develop, license, market, produce, and deliver specialized nuclear packaging for medical radioisotopes, HALEU, spent fuel, and waste
• Quote (David Muir, President; source: Paragon D&E): ""As next‑generation nuclear energy technology goes mainstream, Paragon and NAC are now positioned to provide a more comprehensive range of service offerings for the entire fuel cycle.""
• No photo caption provided."
Decatur Plastic Products (Elton USA),https://www.decaturplastic.com,https://www.plasticstoday.com/injection-molding/elton-manufacturing-expands-through-us-acquisition,Canada's Elton Manufacturing Grows US Footprint,7/9/2025,PlasticsToday,"• Headline: Canada's Elton Manufacturing Grows US Footprint | Publisher: PlasticsToday | Date: 2025-07-09
• Elton Manufacturing acquired the assets of Decatur Plastic Products (North Vernon, IN); operation to run as ""Elton USA""; expands capacity and US presence
• Leadership: Gary Riley Jr. named President of Elton USA; integration began months earlier with window‑frame production at the Indiana facility
• Quote (Tom Boer, Founder, Elton; source: PlasticsToday): ""With this new addition to the Elton family, we will be able to strengthen our relationships with our US customers, gain support and expertise from DPP's highly skilled operations team, and increase capacity to achieve our growth strategy.""
• Quote (Sandro Pigliarolo, SVP Technical Operations, Elton; source: PlasticsToday): ""Elton will become a stronger partner to its US customers while continuing to provide the unparalleled quality, technical expertise, innovation, and service we are known for."""
Hanson International,http://www.hansoninternational.com,https://www.moodyonthemarket.com/hanson-mold-changes-name-to-hanson-international/,Hanson Mold Changes Name To Hanson International,9/1/2022,Moody on the Market,"• Headline: Hanson Mold Changes Name To Hanson International — Publisher: Moody on the Market — Date: 2022-09-01
• Rebranding reflects the company's global role in tooling; updated logo and colors noted.
• Quote (Julie LaVanway, President, Hanson International — Moody on the Market): “The word ‘mold’ served us well for several decades, but it no longer embodies our company’s world-class capabilities in innovative die design and long-term tooling solutions for our customers.”
• Quote (Julie LaVanway, President, Hanson International — Moody on the Market): “Our business has changed so much over the past 50 years, and we want our name to reflect who we are today. The core of what we do continues to be designed and built in St. Joseph, but we also have grown to understand that other companies around the world specialize in certain types of components. Partnering with them has helped us concentrate on the most critical components in our tooling.”
• Quote (Julie LaVanway, President, Hanson International — Moody on the Market): “We work with recognizable global brands. At Hanson International, apprentices can learn from the most knowledgeable journeymen in the country. This is not a dead-end job. There are opportunities for career advancement.”
• Photo: Hanson International building with new signage."
"Legacy Precision Molds, Inc.",http://www.legacyprecisionmolds.com,https://www.mmsonline.com/articles/taking-it-slow-pays-off-for-learning-five-axis-machining-,Taking It Slow Pays Off for Learning Five-Axis Machining,2/1/2016,Modern Machine Shop,"• Headline: Taking It Slow Pays Off for Learning Five-Axis Machining — Publisher: Modern Machine Shop — Date: 2016-02-01
• Feature on Legacy Precision Molds’ incremental adoption of full five-axis machining, including postprocessor collaboration, simplified setups, and tooling strategies.
• Emphasizes process improvements and lessons learned for smoother five-axis blends and productivity.
• No direct quotes appear in this article.
• No photo caption captured."
"M&M Tooling, Inc.",http://www.mmtooling.com,https://www.plasticstoday.com/injection-molding/mold-bases-m-m-owns-its-niche,Mold bases: M&M owns its niche,12/3/2009,PlasticsToday,"Headline — PlasticsToday (2009-12-03)
Profile of Wood Dale, IL-based M&M Tooling’s custom mold base niche; capacity up to 34.5×80 inches; focus on rugged machining and lead-time reduction for mold shops
""You have to have a foundation for your business and for me it was choosing to build custom mold bases."" — Michael Mirante; Owner, M&M Tooling; PlasticsToday
""Building mold bases is a more rugged type of machining where we can take out a lot of material with each pass."" — Michael Mirante; PlasticsToday
""Hogging out mold base pockets isn’t the best utilization of high-speed machine."" — Michael Mirante; PlasticsToday
""With the major investments in machines that mold companies make, along with the labor costs for top-notch machinists with expertise in the high-end core and cavity work, it just doesn’t pay to do mold bases."" — Michael Mirante; PlasticsToday
""We have large machines with a lot of horsepower, and we don’t have the huge overhead that mold shops have. We’re utilizing Mazak machine tools and with our focus on nothing but mold bases, we can turn out the work and help the mold shops shorten the lead times they quote."" — Michael Mirante; PlasticsToday
""Even 10 years ago, I recognized that profit margins for mold shops were being squeezed, and shops were having to do more volume than their capacity allowed."" — Michael Mirante; PlasticsToday
""They had to take on more work with the same capacity, and many found that outsourcing mold bases was a way to free up machine time for the types of jobs that add the most value to the moldmaker."" — Michael Mirante; PlasticsToday
""They’re working hard at getting business in the U.S., so why shouldn’t I?"" — Michael Mirante; PlasticsToday
""We can succeed at manufacturing in the USA, but we really have to get out there and promote ourselves and our capabilities, and let people know the advantages we have to offer. Made in the USA is still a viable marketing tool."" — Michael Mirante; PlasticsToday
Photo: M&M Tooling’s e-mail blast to Illinois mold shops."
Matrix Plastic Products,https://www.matrixplastic.com/,https://www.plasticstoday.com/medical/matrix-plastic-products-celebrates-40th-anniversary-with-new-corporate-name,Matrix Plastic Products celebrates 40th anniversary with new corporate name,3/9/2018,PlasticsToday,"Headline — PlasticsToday (2018-03-09)
Company marks 40 years; rebrands to better reflect integrated moldmaking and medical injection molding services; Wood Dale, IL
""Over the years, as our customers’ demands grew, we responded by broadening our value-added service offerings."" — Paul Ziegenhorn; President; PlasticsToday
""This company has never shied away from technology. We understand that we need to have better equipment than the competition to keep the high-level work coming here."" — Gary Johansson; VP of Quality/Regulatory; PlasticsToday
""It is the more inclusive name and better represents our broader mix of services today."" — Andy Ziegenhorn; COO; PlasticsToday"
"Pelco Tool & Mold, Inc.",https://www.pelcotoolinc.com/,https://www.pelcotoolinc.com/images/pdf/1111%20MMT%20DEPT--Profile.pdf,"Diverse Mold Offerings Sustain Moldmaker, Secures Future Business",11/1/2011,MoldMaking Technology,"Headline — MoldMaking Technology (2011-11-01)
Profile of Glendale Heights, IL mold builder; details equipment additions (Makino HSMC, Hurco 3+2, Mitsubishi EDM) and market focus on caps/closures and medical
""We add new, top-of-the-line machinery annually to keep us on the cutting edge."" — Joel Bianchi; Marketing Director; MoldMaking Technology
""This allowed us to have the resources to be prepared when jobs began to increase … It also helped us to streamline our processes, become more efficient and ultimately, become more competitive."" — Rob Suva; Co-owner/Marketing; MoldMaking Technology
""We will continue to focus our efforts in the caps/closure market and supply the big players in the industry … We also plan to increase our focus on medical opportunities, with a goal of doubling sales in medical components."" — Joel Bianchi; Marketing Director; MoldMaking Technology"
Tri-Par Die & Mold Corporation,http://www.tri-par.com,https://www.plasticsnews.com/article/20050725/NEWS/307259958/tri-par-molding-biz-drives-investment,Tri-Par molding biz drives investment,7/25/2005,Plastics News,"Headline — Plastics News (2005-07-25)
Streamwood/Geneva IL: company expanded molding operation by ~13,000 sq. ft. and added six injection presses to support growth
No direct quotes appear in this article."
Tri-Par Die & Mold Corporation,http://www.tri-par.com,https://www.plasticsnews.com/article/19961111/NEWS/311119940/tri-par-die-relocating,Tri-Par Die relocating,11/11/1996,Plastics News,"Headline — Plastics News (1996-11-11)
Company relocated molding operations to a rented 13,000-sq.-ft. facility (Chicago suburbs) as part of capacity changes
No direct quotes appear in this article."
"Specialty Manufacturers, Inc.",http://www.spcmfg.com,https://www.plasticsmachinerymanufacturing.com/injection-molding/article/13001123/prd-finds-methods-to-enhance-lighting-components,PRD finds methods to enhance lighting components,2/27/2016,Plastics Machinery & Manufacturing,"• PRD finds methods to enhance lighting components — Plastics Machinery & Manufacturing — 2016-02-27
• Trade profile of PRD Inc. (Springville, IN), a division of Specialty Manufacturers, Inc.; notes sister companies D&M Tool and Apollo Plastics; details growth and automation in automotive lighting components
• Quote: “It isn’t just the cost… We are on the forefront of the LED craze… PRD took the chance and purchased a 20-ton Toshiba all-electric press… the volume increased by 600 percent… the rest is history.” — John Passanisi, President, PRD Inc. (PMM)
• Quote: “We came out on top during and after the recession… We had to make some tough choices.” — John Passanisi, President, PRD Inc. (PMM)
• Quote: “The owners explored all avenues of generating cash… Every penny was pinched.” — John Passanisi, President, PRD Inc. (PMM)
• Quote: “We’re trying to keep up with the technology.” — John Passanisi, President, PRD Inc. (PMM)
• Quote: “We have never been a company that is OK with the status quo… always trying to find ways to do things better and be more efficient.” — Mark Murphy, GM, PRD Inc. (PMM)
• Quote: “One of our most significant variable cost drivers is our labor cost… Utilizing automation and robotics where feasible helps us accomplish this goal.” — Mark Murphy, GM, PRD Inc. (PMM)
• Quote: “Acrylic shatters when it gets cut, so we had to do it in a different way.” — Mark Murphy, GM, PRD Inc. (PMM)"
"Decatur Mold Tool & Engineering, Inc.",http://www.decaturmold.com,https://www.plasticsmachinerymanufacturing.com/molds-tooling/article/55298782/robots-put-unattended-operations-within-reach,Robots put unattended operations within reach for mold makers,7/22/2025,Plastics Machinery & Manufacturing,"• Robots put unattended operations within reach for mold makers — Plastics Machinery & Manufacturing — 2025-07-22
• Feature on Decatur Mold’s Tech Center enabling lights-out EDM/milling with Fanuc/Erowa robots and Makino mills; employment ~140; annual revenue about $30M; focus on unmanned machining and setup reduction
• Quote: “We started last year a real drive for productivity and efficiency beyond anything we’ve ever tried before.” — Rhonda Lustenberger, Majority Owner & President, Decatur Mold (PMM)
• Quote: “The thing that mold makers desperately need is a system to make it so that they can basically draw their mold, click a button, and the mold comes out the back… With the manufacturing labor shortage… many of them are retiring, creating a knowledge gap.” — Rick Schultz, Aerospace Program Manager, FANUC America (PMM)
• Quote: “The robots are the easiest part of the whole process… The hardest part is the fixturing, the pathing and then making sure we have good cutting techniques.” — Rhonda Lustenberger, Decatur Mold (PMM)
• Quote: “Service work is… more of a market differentiator… Our service work is about two-thirds of our total revenue.” — Rhonda Lustenberger, Decatur Mold (PMM)
• Quote: “We’re always keeping our eyes open… I would anticipate that our next larger investment will be in software… You’re starting to see AI really take hold… I don’t want to be far behind that.” — Rhonda Lustenberger, Decatur Mold (PMM)"
"Lorentson Manufacturing Co., Inc.",http://www.lorentson.com,https://ivytechcommunitycollegekokomo.wordpress.com/2020/10/14/lorentson-manufacturing-gift-supports-cnc-lab-at-ivy-tech-kokomo/,Lorentson Manufacturing gift supports CNC lab at Ivy Tech Kokomo,10/14/2020,Ivy Tech Kokomo Service Area News,"• Lorentson Manufacturing gift supports CNC lab at Ivy Tech Kokomo — Ivy Tech Kokomo Service Area News — 2020-10-14
• Company-funded CNC Laboratory installed in new Industrial Technology Center; article profiles woman-led, WBE/WBENC-certified tool & die/molding firm in Kokomo and San Benito, TX
• Quote: “We are proud to support Ivy Tech because the College promotes and supports the trades on which our industry relies.” — Christina (Tina) Lorentson, President/CEO, Lorentson Manufacturing (Ivy Tech Kokomo)
• Quote: “This project is vital in supporting Ivy Tech’s mission of giving our local youth exposure to, and training in many of the trades on which our community relies.” — Christina (Tina) Lorentson, President/CEO, Lorentson Manufacturing (Ivy Tech Kokomo)
• Quote: “We’re proud of the leadership the company and Tina Lorentson have provided in encouraging women in the trades.” — Dean McCurdy, Chancellor, Ivy Tech Kokomo (Ivy Tech Kokomo)
• Photo: Tina Lorentson and John Routt on campus viewing the Lorentson Manufacturing CNC Laboratory recently installed in the Industrial Technology Center."
Michiana Global Mold (MG Mold),http://www.mgmold.net,https://www.moldmakingtechnology.com/news/michiana-global-mold-announces-management-transformation,Michiana Global Mold Announces Management Transformation,3/1/2021,MoldMaking Technology,"Headline — MoldMaking Technology (2021-03-01)
Trade brief on MG Mold's management transformation to position for growth and improved responsiveness
No direct quotes appear in this article."
Michiana Global Mold (MG Mold),http://www.mgmold.net,https://www.moldmakingtechnology.com/articles/cross-functional-team-key-to-customer-service-complexity-and-china-partnership,"Cross-Functional Team Key to Customer Service, Complexity and China Partnership",10/23/2019,MoldMaking Technology,"Headline — MoldMaking Technology (2019-10-23)
Feature describes MG Mold's cross-functional journeymen-and-engineer team model and domestic/China partnership to manage complex builds and communication
No direct quotes appear in this article."
North American Lighting (Indiana Tool Plant),https://www.nal.com/,https://indianaeconomicdigest.net/MobileContent/Most-Recent/Most-Recent/Article/Headlight-company-moving-into-Warrick-County-industrial-park/31/135/60585,Headlight company moving into Warrick County industrial park,6/23/2011,Indiana Economic Digest (Evansville Courier & Press),"Headline — Indiana Economic Digest / Evansville Courier & Press (2011-06-23)
NAL breaks ground on $16M tool shop at North Warrick Industrial Park; ~40 jobs; production targeted for January 2012
""Our president really wants to keep it until the announcement (today)… We'll have officials over from Japan for the ceremony, and we'll make most of the announcement at that time."" — Kirk Welter; spokesman; Evansville Courier & Press via Indiana Economic Digest
""The jobs are just excellent… They are machinists, tool makers and engineering jobs… The majority of the investment here is in the sophisticated machinery… these jobs will pay more than $20 per hour."" — Larry Taylor; Warrick County Economic Development Director; Evansville Courier & Press via Indiana Economic Digest"
North American Lighting (Indiana Tool Plant),https://www.nal.com/,https://www.indianahouserepublicans.com/news/press-releases/r74-ellspermann-edition-north-american-lighting-coming-to-northern-warrick-county-6-24-2011/,[r74] Ellspermann Edition: North American Lighting Coming to Northern Warrick County,6/24/2011,Indiana House Republicans (Press Release),"Headline — Indiana House Republicans (2011-06-24)
Press statement notes NAL choosing Warrick County for new tool shop; 42 high-wage jobs for engineers, machinists, toolmakers; shovel-ready site near I‑64/I‑69; incentives from county and IEDC
No direct quotes appear in this article."
ASH Industries,https://www.ashindustries.com/,https://www.katc.com/news/lafayette-parish/lafayette-manufacturer-announces-expansion-to-add-85-jobs,"Lafayette manufacturer announces expansion, to add 85 jobs",7/13/2022,KATC (ABC 3 — Lafayette),"Headline — KATC (2022-07-13)
Local TV recap of ASH Industries’ $5M Lafayette expansion: +20,000 sq. ft., 85 direct jobs, 67 retained, 120 indirect; mentions LED FastStart incentives and state programs
""The expansion of ASH Industries is an important job creation project for the skilled workforce in Lafayette… For more than 30 years, ASH has fostered a strong team, and is set to grow that team further – a testament to the opportunities available in Louisiana’s manufacturing industry."" — Gov. John Bel Edwards; Governor of Louisiana; KATC
""ASH Industries is optimistic about the future of manufacturing in Louisiana and so far has launched phase one of a three-phase program to invest in jobs in our community. The ingredients of economic development in our industry are manufacturing space, a solid employee base and the latest in cutting-edge manufacturing equipment. ASH’s current expansion will directly support and increase the services that we can provide customers who appreciate the benefits of having their products manufactured in our state."" — Hartie Spence; President, ASH Industries; KATC"
"Prime Manufacturing Technologies, Inc.",https://primemfgtech.com/,https://i95business.com/articles/content/quality-value-driven-manufacturing-solutions-located-right-here-in-howard-county-1000,"Quality, Value-Driven Manufacturing Solutions Located Right Here In Howard County",10/9/2019,I95 BUSINESS,"Headline — I95 BUSINESS (2019-10-09)
Local business feature on Prime Manufacturing Technologies’ digital manufacturing, injection molding, composites and CNC capabilities in Savage, Maryland
""We offer the latest in digital design, manufacturing and engineering support… We work closely with our clients to optimize part and mold designs to increase product quality, improve production time and lower production costs."" — Luke Chow; President & CEO, Prime Manufacturing Technologies; I95 BUSINESS
""It is not always cheaper and better to manufacture products from overseas… If the items are high volumes or high value, and can be integrated into our automation system, Prime can generally produce them as competitively as overseas when the overall total cost is considered."" — Luke Chow; President & CEO, Prime Manufacturing Technologies; I95 BUSINESS
""We have the automation, technology and processes to deliver high quality products on time and on budget."" — Luke Chow; President & CEO, Prime Manufacturing Technologies; I95 BUSINESS
""Best of all, we’re with our clients for the long haul, helping them to continuously improve their products as they scale up their business and launch new product lines."" — Luke Chow; President & CEO, Prime Manufacturing Technologies; I95 BUSINESS"
Byrne Tool + Design,http://www.byrne-tool.com,https://www.moldmakingtechnology.com/articles/speed-productivity-gains-and-high-uptime-ease-decision-for-second-five-axis-machine,"Speed, Productivity Gains and High Uptime Ease Decision for Second Five-Axis Machine",5/26/2022,MoldMaking Technology,"Headline — MoldMaking Technology (2022-05-26)
Trade case study on Byrne Tool + Design (Rockford, MI) reducing setups and gaining throughput with compact five-axis CNC machining centers; decision to add a second machine based on speed, uptime and accuracy
No direct quotes appear in this article."
Byrne Tool + Design,http://www.byrne-tool.com,https://www.moldmakingtechnology.com/articles/common-sense-manufacturing-concept-drives-efficiencies-at-byrne-tool,‘Common Sense Manufacturing’ Concept Drives Efficiencies at Byrne Tool,3/9/2018,MoldMaking Technology,"Headline — MoldMaking Technology (2018-03-09)
Profile of Byrne Tool + Design’s continuous improvement system (“Common Sense Manufacturing”) driving lean practices and productivity across the shop
No direct quotes appear in this article."
"Classic Die Holdings, Inc.",http://www.classicdie.com,https://www.crainsgrandrapids.com/news/manufacturing/aiming-small-orchard-creek-capitals-deal-for-classic-die-signals-downmarket-trend-for-private-equity-firm/,Aiming Small? Orchard Creek Capital’s deal for Classic Die signals downmarket trend for private equity firm,11/26/2018,MiBiz / Crain’s Grand Rapids Business,"Headline — Crain’s Grand Rapids Business (2018-11-26)
Northville-based Orchard Creek Capital acquires Classic Die (Grand Rapids, MI), a 40-year-old plastic injection molder with in-house mold design and tooling; article frames deal as part of a small-cap, operations-focused PE strategy
No direct quotes appear in this article."
"Classic Die, Inc.",http://www.classicdie.com,https://www.plasticsnews.com/news/investment-firm-buys-three-plastics-processors,Investment firm buys three plastics processors,12/10/2020,Plastics News,"Headline — Plastics News (2020-12-10)
Roundup notes Orchard Creek Capital’s plastics portfolio, referencing its 2018 acquisition of Classic Die, a Grand Rapids-based injection molder offering mold design, prototyping and construction
No direct quotes appear in this article."
"CS Tool Engineering, Inc.",http://www.cste.com,https://www.plasticsnews.com/article/20140529/NEWS/140529907/amba-honors-cs-tool-s-don-snow-as-mold-builder-of-the-year,AMBA honors CS Tool's Don Snow as Mold Builder of the Year,5/29/2014,Plastics News,"• Headline: AMBA honors CS Tool's Don Snow as Mold Builder of the Year — Plastics News — 2014-05-29
• AMBA recognized Don Snow (operations manager, CS Tool Engineering, Cedar Springs, MI) as Mold Builder of the Year.
• Context: Annual AMBA Conference; recognition highlights workforce development and industry leadership.
• No direct quotes appear in this article."
"CS Tool Engineering, Inc.",http://www.cste.com,https://www.moldmakingtechnology.com/articles/small-shop-honorable-mention-cs-tool-engineering-in-the-business-of-customer-service,Small Shop Honorable Mention: CS Tool Engineering — In the Business of Customer Service,11/12/2010,MoldMaking Technology,"• Headline: Small Shop Honorable Mention: CS Tool Engineering — MoldMaking Technology — 2010-11-12
• Profile: Trade feature on CS Tool Engineering’s customer-service-driven approach; notes Cedar Springs, MI location and focus on injection/compression molds.
• Recognition: Shop honored in MMT’s annual Small Shop program.
• No direct quotes appear in this article."
"Deppe Mold and Tooling, Inc.",https://deppemold.com,https://www.moldmakingtechnology.com/articles/hot-runner-truths-myths-and-overlooked-areas-,"Hot Runner Truths, Myths and Overlooked Areas",2/1/2024,MoldMaking Technology,"• Headline: Hot Runner Truths, Myths and Overlooked Areas — MoldMaking Technology — 2024-02-01
• Technical piece discussing hot-runner design considerations relevant to injection mold builders and processors.
• Photo: Photo Credit: Deppe Mold & Tooling.
• No direct quotes appear in this article."
"Die-Tech & Engineering, Inc.",https://www.dietech-gr.com,https://www.crainsgrandrapids.com/news/manufacturing/automation-helps-manufacturers-adjust-operations-to-serve-health-care-needs/,Automation helps manufacturers adjust operations to serve health care needs,4/12/2020,Crain’s Grand Rapids Business (MiBiz),"• Headline: Automation helps manufacturers adjust operations to serve health care needs — Crain’s Grand Rapids Business — 2020-04-12
• Coverage: Die‑Tech & Engineering rapidly built ventilator die tooling in 5 days amid COVID‑19 response.
• Quote: “We understood the opportunity we had to use our expertise and hopefully make a difference in this crisis somehow and immediately got suppliers and service providers on the phone and on board to help us build these tools as fast as possible,” — Adam Berry, manufacturing engineer, Die‑Tech & Engineering, to Crain’s Grand Rapids Business.
• Quote: “The nature of die and mold building is more one‑off projects than it is mass production, so the Industry 4.0 automation most people think of is not necessarily always applicable to us, but in as many of the areas that we can, we have streamlined and automated much of the process,” — Adam Berry, to Crain’s Grand Rapids Business.
• Quote: “This is certainly the shortest lead time we’ve accomplished on a project of this size,” — Adam Berry, to Crain’s Grand Rapids Business.
• Photo: Esys Automation image captioned in article; line shows GM mask line built in six days."
"Eifel Mold & Engineering (Eifel, Inc.)",http://www.eifel-inc.com,https://www.moldmakingtechnology.com/news/eifel-mold-engineering-celebrates-50-years-in-moldmaking,Eifel Mold & Engineering Celebrates 50 Years in Moldmaking,9/5/2023,MoldMaking Technology,"• Headline: Eifel Mold & Engineering Celebrates 50 Years in Moldmaking — Publisher: MoldMaking Technology — Date: 2023-09-05
• 50-year milestone feature on Fraser, MI-based mold builder founded by German-born patternmaker Josef Hecker; highlights longevity and specialization in injection mold manufacturing
• No direct quotes appear in this article."
"Eifel Mold & Engineering (Eifel, Inc.)",http://www.eifel-inc.com,https://www.ptonline.com/news/eifel-mold-engineering-celebrates-50-years-in-moldmaking-2,Eifel Mold & Engineering Celebrates 50 Years in Moldmaking,9/8/2023,Plastics Technology,"• Headline: Eifel Mold & Engineering Celebrates 50 Years in Moldmaking — Publisher: Plastics Technology — Date: 2023-09-08
• Trade news item marking Eifel’s 50th anniversary; notes origins under founder Josef Hecker and continuing focus on production and prototype tooling for automotive/interiors
• No direct quotes appear in this article."
Franchino Mold & Engineering Company,http://www.franchino.com,https://www.plasticsnews.com/article/20141007/NEWS/141009935/franchino-adding-space-equipment-for-continued-large-mold-production,"Franchino adding space, equipment for continued large-mold production",10/7/2014,Plastics News,"• Headline: Franchino adding space, equipment for continued large-mold production — Publisher: Plastics News — Date: 2014-10-07
• Lansing, MI mold builder to add ~65,000 sq. ft. and invest ~$5M to expand large-mold manufacturing capacity and machining assets
• No direct quotes appear in this article."
"Krieger Craftsmen, Inc.",http://www.kriegercraftsmen.com,https://www.crainsgrandrapids.com/news/manufacturing/walker-manufacturer-krieger-craftsmen-files-for-chapter-11-bankruptcy/,Walker manufacturer Krieger Craftsmen files for Chapter 11 bankruptcy,10/15/2020,Crain’s Grand Rapids Business (MiBiz),"• Headline: Walker manufacturer Krieger Craftsmen files for Chapter 11 bankruptcy — Publisher: Crain’s Grand Rapids Business — Date: 2020-10-15
• Company filed for Chapter 11 under the Small Business Reorganization Act Subchapter V; coverage frames move as restructuring path amid industry conditions
• No direct quotes appear in this article."
"Krieger Craftsmen, Inc.",http://www.kriegercraftsmen.com,https://www.plasticsnews.com/article/20180709/NEWS/180709931/mold-maker-krieger-launches-j-flex-division,Mold-maker Krieger launches J‑Flex division,7/9/2018,Plastics News,"• Headline: Mold-maker Krieger launches J‑Flex division — Publisher: Plastics News — Date: 2018-07-09
• Grand Rapids, MI mold builder created J‑Flex division to specialize in reflector mold inserts for transportation lighting; notes automotive market focus
• No direct quotes appear in this article."
"Legacy Precision Molds, Inc.",http://www.legacyprecisionmolds.com,https://www.mmsonline.com/articles/five-axis-blends-require-minding-ballnose-tolerances-,Five‑Axis Blends Require Minding Ballnose Tolerances,1/22/2016,Modern Machine Shop,"• Headline: Five‑Axis Blends Require Minding Ballnose Tolerances — Publisher: Modern Machine Shop — Date: 2016-01-22
• Technical article highlights Legacy Precision Molds’ approach to achieving smooth five‑axis blends via ballnose tool tolerance management
• No direct quotes appear in this article."
"Maximum Mold Group (Max, Max2, Max3)",http://www.maximummoldgroup.com,https://www.moodyonthemarket.com/maximum-mold-expands-again-by-acquiring-mach-mold-of-bh/,Maximum Mold Expands Again By Acquiring Mach Mold of BH,7/12/2017,Moody on the Market,"• Headline: Maximum Mold Expands Again By Acquiring Mach Mold of BH — Publisher: Moody on the Market — Date: 2017-07-12
• Acquisition: David & Cindy LaGrow purchased Mach Mold (Benton Harbor, MI); converted to Max 3; workforce retained; expands die-cast and injection tooling capacity
• Quote — David LaGrow, President (Moody on the Market): “The opportunity to expand our capacity at this time was a great move for the Maximum Team. Mach Mold has a great workforce.”
• Quote — Vicki Mach (Moody on the Market): “Bill will stay on in a consulting role for the next couple of months to ease the transition.”"
"Model Die & Mold, Inc.",http://www.modeldie.com,https://www.moldmakingtechnology.com/articles/cnc-gives-moldmaker-more-capacity-greater-reach-for-large-contoured-molds,"CNC Gives Moldmaker More Capacity, Greater Reach for Large Contoured Molds",1/1/2018,MoldMaking Technology,"- Headline/Source/Date: CNC Gives Moldmaker More Capacity, Greater Reach for Large Contoured Molds — MoldMaking Technology — 2018-01-01
- Summary: Case study on Model Die & Mold (Grand Rapids, MI) adding large-format CNC capacity to relieve finishing bottlenecks and keep more work in-house for large contoured molds.
- No direct quotes appear in this article."
"Venture Global Engineering, LLC",http://www.ventureglobalengineering.com,https://thecountypress.mihomepaper.com/articles/venture-global-engineering/,Venture Global Engineering,8/30/2018,"The County Press (Lapeer County, MI)","• Headline: Venture Global Engineering — Publisher: The County Press — Date: 2018-08-30
• Local business profile of Almont-based mold builder/tooling firm; services include mold design/builds/repairs, metal fabrication, imported tooling; notes long-tenured staff and large-CNC capacity
• No direct quotes appear in this article."
"Viking Tool & Engineering, Inc.",http://www.vikingtooleng.com,https://www.moldmakingtechnology.com/articles/advanced-edm-features-increase-efficiency-and-change-perceptions,Advanced EDM Features Increase Efficiency and Change Perceptions,4/22/2019,MoldMaking Technology,"• Headline: Advanced EDM Features Increase Efficiency and Change Perceptions — Publisher: MoldMaking Technology — Date: 2019-04-22
• Case study on Viking Tool & Engineering’s OPS‑Ingersoll Gantry Eagle 1200 sinker EDM: replaced three older EDMs; faster, more precise; ~50% reduction in electrode usage; productivity and accuracy gains
• No direct quotes appear in this article."
Roberson Machine Company,https://robersontool.com/,No news,No news,,,No news found after applying filters (local/regional/trade priority; junk excluded).
Toledo Metal Spinning Company,https://toledometalspinning.com/,https://www.thefabricator.com/thefabricator/news/shopmanagement/toledo-metal-spinning-named-a-top-100-us-small-business,Toledo Metal Spinning named a top 100 U.S. small business,9/6/2024,The Fabricator,"Toledo Metal Spinning named a top 100 U.S. small business — The Fabricator (2024-09-06)
Recognized on the U.S. Chamber of Commerce CO—100 list; selected from more than 14,000 applicants; honors small businesses nationwide
No direct quotes appear in this article."
Toledo Metal Spinning Company,https://toledometalspinning.com/,https://www.metalformingmagazine.com/article/?%2Fother-processes%2Fspinning%2Ftoledo-metal-spinning-named-one-of-america-s-top-100-small-businesses=,Toledo Metal Spinning Named One of America’s Top 100 Small Businesses,9/10/2024,MetalForming Magazine,"Toledo Metal Spinning Named One of America’s Top 100 Small Businesses — MetalForming Magazine (2024-09-10)
U.S. Chamber of Commerce CO—100 honors TMS as one of America’s top small businesses; recognition highlights growth and innovation
No direct quotes appear in this article."
Toledo Metal Spinning Company,https://toledometalspinning.com/,https://www.toledochamber.com/blog/celebrating-toledos-top-small-businesses-in-america-balance-grille-and-toledo-metal-spinning-make-co-100-list,Celebrating Toledo’s Top Small Businesses in America: Balance Grille and Toledo Metal Spinning Make CO—100 List,9/10/2024,Toledo Regional Chamber of Commerce,"Celebrating Toledo’s Top Small Businesses in America — Toledo Regional Chamber of Commerce (2024-09-10)
Chamber highlights TMS inclusion on CO—100 list; notes company history since 1929 and recovery after a 1998 fire
""We are very excited to be part of this esteemed group of CO—100 honorees."" — Eric Fankhauser, vice president, Toledo Regional Chamber of Commerce blog
Photo: Blog post includes company and community imagery where available"
South Bend Form Tool,https://sbform.com/,https://docs.southbendin.gov/WebLink/0/edoc/66941/04-11-16%20Common%20Council%20Meeting%20Packet.pdf,"Resolution: Five-Year Personal Property Tax Abatement for South Bend Form Tool Co., Inc.",4/11/2016,City of South Bend Common Council,"Resolution: Five-Year Personal Property Tax Abatement for South Bend Form Tool Co., Inc. — City of South Bend Common Council (2016-04-11)
Council packet records designation of an economic revitalization area and a five year personal property tax abatement for South Bend Form Tool; local government source; legislative action documented; updated date appears on page if any.
No direct quotes appear in this article."
Pinto Products,http://pintoproducts.com,https://secondwavemedia.com/partsbiz0415/,New business picture calls for new way of thinking,4/15/2010,Second Wave,"New business picture calls for new way of thinking — Second Wave (2010-04-15)
Article summarizes Kalamazoo Gazette reporting on collaboration between Kalamazoo Screw Products and Pinto Products to produce parts for a disinfectant fogging tank; highlights small manufacturer agility; regional business focus.
""The fact that things are tight makes it a no-brainer and we’re doing whatever we can to survive"" — Matthew Pinto, owner, Kalamazoo Gazette via Second Wave.
""[He] lost about $2.5 million 'almost overnight' when production of Volvo and Lincoln automobiles went overseas"" — Evan Eichhorn, Kalamazoo Screw Products, Kalamazoo Gazette via Second Wave."
Apex Machine Company,https://apexmachine.com,https://www.packworld.com/leaders-new/machinery/converting-equipment/press-release/13367120/apex-machine-company-acquires-desco,Apex Machine Company acquires Desco,2/20/2015,Packaging World,"Apex Machine Company acquires Desco — Packaging World (2015-02-20)
Apex acquires assets of Ohio based Desco Equipment Corporation; expands manufacturing capacity; broadens machine range and support for closure and component printing systems; includes details on Desco’s 50,000 sq ft facility on eight acres; industry trade coverage.
""With the tremendous synergies between our two companies, the acquisition of Desco makes a lot of sense as it adds additional manufacturing capacity and a wider machine range to the existing Apex program"" — Bob Coningsby, CEO, Apex Machine Company, Packaging World.
""We are very pleased and excited to announce the purchase and sale of Desco assets knowing that Apex will provide the support and guidance to carry the Desco name and product lines into the future"" — Leo Henry, President, Desco, Packaging World.
Photo: ""Desco's Rotary Closure Printer"" (image caption on article)."
Apex Machine Company,https://apexmachine.com,https://www.plastech.biz/en/news/Apex-Machine-unveils-game-changing-printing-technology-10703,Apex Machine unveils game changing printing technology,8/22/2016,Plastech,"Apex Machine unveils game changing printing technology — Plastech (2016-08-22)
Trade coverage of Apex’s S 10 digital ink jet printer and other systems shown at K 2016; emphasizes higher resolution on demand printing and fast changeovers; relevant to medical and packaging components.
No direct quotes appear in this article."
Aalbers Tool & Mold Inc.,https://aalberstool.com/,https://windsornewstoday.ca/windsor/news/2015/03/17/auto-parts-manufacturer-getting-support,Support For Auto Parts Maker,3/17/2015,Windsor News Today (BlackburnNews.com),"Support For Auto Parts Maker — Windsor News Today (2015-03-17)
Ontario grant of $1 million will create 33 new jobs at Aalbers Tool & Mold in Oldcastle; funds support equipment purchases and training; part of a larger $10 million investment plan.
""The industry is booming, and we're at the point where we can't keep up with demand. So with this, we're able to buy new equipment, new software, new technology and most importantly, hire and train new employees."" — Gary Aalbers, CEO, Windsor News Today.
Photo: Aalbers Tool & Mold CEO Gary Aalbers; shop floor and machinery images credited to Mike Vlasveld on March 17, 2015."
"Kingson Mold and Machine, Inc.",https://kingsonmold.com/,https://www.moldmakingtechnology.com/articles/a-technical-and-business-approach-to-moldmaking-increases-growth-opportunities,A Technical and Business Approach to Moldmaking Increases Growth Opportunities,12/3/2020,MoldMaking Technology,"A Technical and Business Approach to Moldmaking Increases Growth Opportunities — MoldMaking Technology (2020-12-03)
Feature on next-generation ownership and cultural change at Kingson Mold and Machine; focuses on productivity improvements and modernization initiatives.
No direct quotes appear in this article."
Titan Tool & Die Co.,https://titantooldie.com/,https://www.unifor.org/news/all-news/unifor-members-workers-and-community-rally-against-titan-tool-die,"Unifor members, workers and community rally against Titan Tool & Die",9/10/2025,Unifor,"Unifor members, workers and community rally against Titan Tool & Die — Unifor (2025-09-10)
Rally outside Windsor facility over lockout and alleged shifts of production out of Canada.
""Shame on Titan Tool and Die for abandoning the very workers who have built this company"" — Lana Payne, Unifor National President; ""This isn’t just about a paycheck. This is about principle"" — Emile Nabbout, Local 195 President, Unifor."
Titan Tool & Die Co.,https://titantooldie.com/,https://www.unifor.org/news/all-news/lockout-escalates-titan-tool-die-moves-raw-materials-us,Lockout escalates as Titan Tool & Die moves raw materials to U.S.,8/21/2025,Unifor,"Lockout escalates as Titan Tool & Die moves raw materials to U.S. — Unifor (2025-08-21)
Union alleges removal of raw materials from Windsor plant to U.S. in midst of lockout.
""This company is trying to pull a fast one on our members"" — Lana Payne, Unifor National President; ""What cuts the deepest is … they’ve fed off the skill and loyalty of our members for decades"" — Emile Nabbout, Local 195 President, Unifor."
General Tool Company (GTC),https://gentool.com/,https://gentool.com/news/3/,Gerald R. Ford CVN 78 Carrier,8/3/2017,General Tool Company (news page),"Gerald R. Ford CVN 78 Carrier — General Tool Company (2017-08-03)
GTC participated in commissioning event for USS Gerald R. Ford aircraft carrier.
No direct quotes appear in this article."
"Die Makers Manufacturing, LLC",https://diemakersmfg.com/,https://www.diemakersmfg.com/news/,Die Makers Launches 4‑Axis CNC Turning Services,,Die Makers Manufacturing (company news),"Die Makers Launches 4‑Axis CNC Turning Services — Die Makers Manufacturing (news page)
Announces that they now provide 4‑axis CNC turning services, supporting close tolerance parts up to 10""; internal service expansion news.
No direct quotes appear in this article."
"Precision Forging Dies, Inc.",https://www.precisionforgingdies.com/,https://www.inforuptcy.com/browse-filings/california-central-bankruptcy-court/2%3A23-bk-12015/bankruptcy-case-precision-forging-dies-inc,Bankruptcy Case Filed and Later Dismissed,2023,Inforuptcy / court public record,"Bankruptcy Case Filed and Later Dismissed — Inforuptcy public court record (2023)
Documents show Precision Forging Dies, Inc. filed a Chapter 7 (or Chapter 11) case in California and that the court later dismissed the case.
No direct quotes appear in this article."
Greenville Tool & Die,https://www.greenvilletdi.com/,https://www.moldmakingtechnology.com/articles/michigan-mold-builder-greenville-tool-die-looks-to-the-future,Michigan Mold Builder Greenville Tool & Die Looks to the Future,6/1/2019,MoldMaking Technology,"Michigan Mold Builder Greenville Tool & Die Looks to the Future — MoldMaking Technology (2019-06-01)
Profile article on Greenville TDI modernization strategy and succession planning; discusses workforce development and equipment investment.
No direct quotes appear in this article."
"Die Technology, Inc.",https://dietechnology.com/,https://northwrightcounty.today/2020/08/two-new-businesses-coming-to-st-michael/,Two New Businesses Coming to St. Michael,8/22/2020,North Wright County Today,"Two New Businesses Coming to St. Michael — North Wright County Today (2020-08-22)
City council approved zoning and TIF for a Die Technologies and Nanotechnologies precision manufacturing facility; plan calls for a 30,000 sq ft building with a future 15,000 sq ft addition; site at Naber Ave and Hwy 241; project expected to increase market value by about $3.8 million; employment and tax base benefits noted.
No direct quotes appear in this article."
"Die Technology, Inc.",https://dietechnology.com/,https://www.ctemag.com/news/die-technology-inc-creates-sister-company,Die Technology Inc. creates sister company,5/7/2019,Cutting Tool Engineering,"Die Technology Inc. creates sister company — Cutting Tool Engineering (2019-05-07)
Die Technology announced creation of sister company Nanotech Precision to handle high volume micro components; both led by Dale Skoog; Die Technology remains focused on high precision stamping dies and tooling; employment figures cited for Osseo MN operations and Nanotech.
""We are excited about the formation of Nanotech Precision, which will help both companies specialize further in their fields and continue our legacy of designing revolutionary devices."" — Dale Skoog, Cutting Tool Engineering."
Precision Die Systems Corporation,https://www.precisiondiesystems.com/,https://chippewa-wi.com/final-ccedc-2019-spring-newsletter-lores/,SPRING 2019 — Business Retention Events feature Precision Die Systems tour,5/1/2019,Chippewa County Economic Development Corporation,"SPRING 2019 — Business Retention Events feature Precision Die Systems tour — Chippewa County Economic Development Corporation (2019-05-01)
Newsletter notes a Business Retention and Expansion facility tour at Precision Die Systems Corp at the Chippewa Valley Innovation Center; event provided company progress update to officials and local businesses; context on CCEDC programming provided.
No direct quotes appear in this article."
"Precision Die and Stamping, Inc.",https://precisiondie.com/,https://publicdocumentarchive.tempe.gov/Docs/HearingOfficer/20080520FinalAction.pdf,"Hearing Officer May 20, 2008 — Request by Precision Die and Stamping (PL070420)",5/20/2008,City of Tempe Hearing Officer,"Hearing Officer May 20, 2008 — Request by Precision Die and Stamping (PL070420) — City of Tempe (2008-05-20)
Official agenda documents show a public hearing item for Precision Die and Stamping; indicates active municipal review of a site request; supports company presence at 1704 W 10th St Tempe.
No direct quotes appear in this document."
Precision Resource,https://www.precisionresource.com/,https://www.additivemanufacturing.media/news/precision-resource-collaborates-with-3d-systems-to-offer-metal-additive-manufacturing,Precision Resource Collaborates With 3D Systems to Offer Metal Additive Manufacturing,7/8/2024,Additive Manufacturing,"Precision Resource Collaborates With 3D Systems to Offer Metal Additive Manufacturing — Additive Manufacturing (2024-07-08)
Trade report on partnership between Precision Resource and 3D Systems to scale metal AM; includes plan to integrate two DMP Flex 350 Dual printers into workflow; facilities in Huntington Beach CA referenced.
No direct quotes appear in this article."
Precision Resource,https://www.precisionresource.com/,https://www.metal-am.com/precision-resource-adds-two-dmp-flex-350-am-machines-from-3d-systems/,Precision Resource adds two DMP Flex 350 AM machines from 3D Systems,7/9/2024,Metal AM,"Precision Resource adds two DMP Flex 350 AM machines from 3D Systems — Metal AM (2024-07-09)
Notes strategic partnership with 3D Systems; details purchase of two DMP Flex 350 Dual machines; aims to accelerate AM in high‑criticality markets.
No direct quotes appear in this article."
"F&S Tool, Inc.",https://fstool.com/,https://www.plasticsnews.com/news/berry-buys-fs-it-builds-its-global-tooling-capabilities,Berry buys F&S as it builds its global tooling capabilities,4/10/2024,Plastics News,"Berry buys F&S as it builds its global tooling capabilities — Plastics News (2024-04-10)
Berry Global acquires F&S Tool of Erie PA; expands global tooling capability across injection blow compression and thermoform molds; confirms closing April 5 2024.
No direct quotes appear in this article."
"F&S Tool, Inc.",https://fstool.com/,https://www.plasticstoday.com/packaging/berry-global-adds-f-s-tool-to-portfolio,Berry Global Adds F&S Tool to Portfolio,4/11/2024,PlasticsToday,"Berry Global Adds F&S Tool to Portfolio — PlasticsToday (2024-04-11)
Coverage of Berry Global’s acquisition of F&S Tool; highlights access to full suite of tooling capabilities and faster turnaround for customers.
""The integration of F&S Tool’s talented teams and market‑leading innovation capabilities combined with Berry’s global operations reinforces the company’s commitment to providing customers …"" — Kevin Kwilinski, CEO, PlasticsToday."
"X‑Cell Tool & Mold, Inc.",https://xcelltool.com/,https://www.moldmakingtechnology.com/news/sybridge-technologies-completes-acquisition-of-x-cell-tool-and-mold-inc,"SyBridge Technologies Completes Acquisition Of X‑Cell Tool & Mold, Inc.",11/19/2020,MoldMaking Technology,"SyBridge Technologies Completes Acquisition Of X‑Cell Tool & Mold, Inc. — MoldMaking Technology (2020-11-19)
Reports SyBridge’s acquisition of X‑Cell Tool & Mold of Fairview PA; first medical tooling acquisition for SyBridge; supplements mobility market presence via Concours Technologies subsidiary.
No direct quotes appear in this article."
"X‑Cell Tool & Mold, Inc.",https://xcelltool.com/,https://www.mbabizmag.com/2020/11/18/sybridge-technologies-completes-acquisition-of-x-cell-tool-and-mold-inc/,"SyBridge Technologies Completes Acquisition of X‑Cell Tool and Mold, Inc.",11/18/2020,MBA Business Magazine (Erie),"SyBridge Technologies Completes Acquisition of X‑Cell Tool and Mold, Inc. — MBA Business Magazine (2020-11-18)
Local business coverage of SyBridge acquisition of X‑Cell Tool & Mold; emphasizes expansion into medical tooling and regional manufacturing footprint.
No direct quotes appear in this article."
Moore Special Tool Company / Moore Engineering,https://www.moorespecialtool.com/,https://www.moore-engineering.com/projects,Moore Engineering Honored by U.S. Senator Chris Murphy,,Moore Engineering News Feed,"Moore Engineering Honored by U.S. Senator Chris Murphy — Moore Engineering News Feed
Local recognition of Moore’s manufacturing excellence; company legacy connection to Moore Special Tool cited in news feed.
No direct quotes appear in this article."
Re‑Strike Machine & Fabrication,https://re-strike.ca/,https://re-strike.ca/,Re‑Strike 5.0 marks our 5th expansion in the past 20 years,2024-11,Re‑Strike Machine & Fabrication News,"Re‑Strike 5.0 marks our 5th expansion in the past 20 years — Re‑Strike Machine & Fabrication (Nov 2024)
Company opens newly expanded precision manufacturing space; notes past expansions; community / contract manufacturing emphasis.
No direct quotes appear in this article."
Glider Guard Tool & Die Inc.,https://gliderguard.com/,https://windsorite.ca/2024/03/investment-announced-for-glider-guard-tool-die-inc/,Investment Announced For Glider Guard Tool & Die Inc.,3/25/2024,Windsorite.ca,"Investment Announced For Glider Guard Tool & Die Inc. — Windsorite.ca (2024-03-25)
Glider Guard Tool & Die Inc. is investing $2,840,515 in expansion; will add seven new jobs and retain 88 existing positions; Ontario government will provide $246,077 in funding through Regional Development Program.
""The expansion … will allow us to stay competitive in the automotive tooling sector … funding opportunities like … Regional Development Program allow us to invest in our operations and employees …"" — Brenn Cox, Engineering Manager, Glider Guard Tool & Die Inc."
"Expert Tool & Machine, Inc.",https://www.etmusa.com/,https://law.justia.com/cases/texas/fifth-court-of-appeals/2015/05-14-00605-cv.html,"Expert Tool & Machine, Inc. v. Sean Petras, et al — Appeal from 95th Judicial District Court of Dallas County",8/28/2015,Justia (Texas Fifth District Court of Appeals),"Expert Tool & Machine, Inc. v. Sean Petras, et al — Appeal from 95th Judicial District Court of Dallas County — Justia (2015-08-28)
Dallas appeals court affirms summary judgment; case centers on alleged trade secret misappropriation and related claims; former employees formed APS Industrial Services; ETM is Dallas based.
""This case involves the alleged misappropriation of a trade secret ..."" — Opinion by Justice Bridges, Texas Fifth District Court of Appeals, Justia.
""We affirm the trial court’s judgment."" — Opinion by Justice Bridges, Justia."
Icon Machine Company (now part of Precision Aerospace Holdings),https://www.iconmachineshop.com/,https://aviationweek.com/space/commercial-space/dallas-investors-buy-applegate-icon-form-precision-aerospace,"Dallas Investors Buy Applegate, Icon To Form Precision Aerospace",9/1/2022,Aviation Week Network,"Dallas Investors Buy Applegate, Icon To Form Precision Aerospace — Aviation Week Network (2022-09-01)
CIC Partners and Juniper Capital acquire Applegate EDM and Icon Machine to form Precision Aerospace; focus on precision metal work for defense and commercial space; Dallas Fort Worth region platform.
No direct quotes appear in this article."
Icon Machine Company (now part of Precision Aerospace Holdings),https://www.iconmachineshop.com/,https://dallasinnovates.com/dallas-precision-aerospace-holdings-acquires-owens-machine-and-tool-company/,Dallas’ Precision Aerospace Holdings Acquires Owens Machine and Tool Company,5/8/2024,Dallas Innovates,"Dallas’ Precision Aerospace Holdings Acquires Owens Machine and Tool Company — Dallas Innovates (2024-05-08)
Notes prior acquisitions of Applegate EDM and Icon Machine in 2022; Precision platform reaches four companies in DFW; AS9100 and ITAR certifications referenced.
""We’re thrilled to add Owens to Precision’s growing platform."" — Pete Stegmaier, CEO, Dallas Innovates."
Cavalier Tool & Manufacturing Ltd.,https://www.cavaliertool.com/,https://www.cavaliertool.com/how-to-build-a-legacy-in-manufacturing/,50 for 50: How To Build A Legacy in Mold Making,9/29/2025,Cavalier Tool News,"50 for 50: How To Build A Legacy in Mold Making — Cavalier Tool (2025-09-29)
Company launches 50-for-50 campaign—50 stories over 50 posts to highlight its history, technology, culture, and future direction in mold making.
No direct quotes appear in this article."
Delva Tool & Machine Corporation,https://www.delvatool.com/,https://www.whitewolfcapital.com/news/cmth-acquires-delva-tool-machine-inc/,"CMTH acquires Delva Tool & Machine, Inc.",9/30/2020,White Wolf Capital / CMTH,"CMTH acquires Delva Tool & Machine, Inc. — White Wolf Capital / CMTH (2020-09-30)
Consolidated Machine & Tool Holdings acquires Delva Tool from Stephen Voellinger; adds advanced robotics and automation capability to its portfolio.
""We are pleased to welcome Delva Tool and Machine to the CMTH family"" — Sean Lafferty, CFO, CMTH."
"Lowell, Inc.",https://lowellinc.com/,https://lowellinc.com/from-legacy-to-leading-edge-lowells-latest-upgrades-in-implantable-device-manufacturing/,From Legacy to Leading‑Edge: Lowell’s Latest Upgrades in Implantable Device Manufacturing,1/20/2025,Lowell Inc.,"From Legacy to Leading‑Edge: Lowell’s Latest Upgrades in Implantable Device Manufacturing — Lowell Inc. (2025-01-20)
Lowell replaced legacy Y axis Mill/Turn MAZY1; upgraded Swiss machining; expanded milling; added optical profilometer and improvements to inspection automation; tighter tolerances; faster turnaround capability.
No direct quotes appear in this article."
"Lowell, Inc.",https://lowellinc.com/,https://lowellinc.com/reducing-medical-device-inspection-costs-without-sacrificing-quality/,Reducing Medical Device Inspection Costs Without Sacrificing Quality,8/18/2025,Lowell Inc.,"Reducing Medical Device Inspection Costs Without Sacrificing Quality — Lowell Inc. (2025-08-18)
Explores strategies to streamline inspection planning in medical device manufacturing; emphasizes design‑for‑test, statistical methods, and reducing redundant checks under tight quality constraints.
No direct quotes appear in this article."
Accumold,https://www.accumold.com/,https://www.accu-mold.com/about-us/news/showcasing-strategic-micro-molding-expertise-at-medevice-boston-2025/,Showcasing Strategic Micro Molding Expertise at MEDevice Boston 2025,9/9/2025,Accumold News,"Showcasing Strategic Micro Molding Expertise at MEDevice Boston 2025 — Accumold News (2025-09-09)
Accumold will participate in MEDevice Boston 2025; present micro molding advances for medical OEMs; align with medical device trends toward miniaturization.
No direct quotes appear in this article."
Accumold,https://www.accumold.com/,https://www.designnews.com/design-engineering/accumold-showcases-medical-micro-molding-at-md-m-east,Accumold Showcases Medical Micro Molding at MD&M East,4/28/2025,Design News,"Accumold Showcases Medical Micro Molding at MD&M East — Design News (2025-04-28)
Accumold will exhibit at MD&M East May 2025 showing thin‑walled cannulas molding and micro injection capabilities; emphasizes ISO13485 cleanroom and micro tolerances performance.
""Our presence at MD&M East reflects our commitment to supporting the rapid evolution of the medical device industry"" — Brett Saddoris, Technical Sales Manager, Accumold."
Simtec Silicone Parts LLC,https://www.simtec-silicone.com/,https://www.simtec-silicone.com/blogs/simtec-makes-news-at-mdm-west-medical-show/,SIMTEC Makes News at MD&M West Medical Show,4/7/2025,SIMTEC Blog,"SIMTEC Makes News at MD&M West Medical Show — SIMTEC (2025-04-07)
SIMTEC exhibited at MD&M West; discussed projects in LSR injection and micro molding for medical device components; focus on bringing design‑for‑manufacturing early in projects.
""We do almost everything … One of our most high‑volume, state‑of‑the‑art products we have is our glucose monitoring device."" — (unnamed) — SIMTEC website blog."
Simtec Silicone Parts LLC,https://www.simtec-silicone.com/,https://www.simtec-silicone.com/blogs/mdm-west-2025-show-a-success-for-simtec-rico-group/,MD&M West 2025 Show: A Success for SIMTEC & RICO Group,2/19/2025,SIMTEC Blog,"MD&M West 2025 Show: A Success for SIMTEC & RICO Group — SIMTEC (2025-02-19)
SIMTEC and RICO Group had strong presence at MD&M West; emphasis on new contacts, medical tooling projects, LSR innovation.
No direct quotes appear in this article."
"ProMed Molded Products, Inc.",https://promedmolding.com/,https://www.plasticstoday.com/medical/promed-molded-products-follows-medtech-crowd-to-costa-rica,ProMed Molded Products Follows Medtech Crowd to Costa Rica,5/20/2025,PlasticsToday,"ProMed Molded Products Follows Medtech Crowd to Costa Rica — PlasticsToday (2025-05-20)
ProMed building a production facility in Grecia Costa Rica’s Green Valley Business and Technology Park; focus on silicone and thermoplastic over‑molding insert molding and value‑added assembly; expansion adds regional jobs by end of 2025.
""Costa Rica provides a strategic location with a highly skilled workforce and we are excited to bring new job opportunities while enhancing our ability to serve customers worldwide."" — Clint Schneider, President, PlasticsToday."
"ProMed Molded Products, Inc.",https://promedmolding.com/,https://www.rubbernews.com/expansion/promed-molded-products-expands-clean-room-focuses-automation,ProMed focusing on automation with expanded clean room,10/30/2024,Rubber News,"ProMed focusing on automation with expanded clean room — Rubber News (2024-10-30)
HQ Class 7 cleanroom in Plymouth MN expanded; houses silicone molding presses up to 130 tons automated inspection cells and areas for secondary processing; supports higher‑volume medical programs.
No direct quotes appear in this article."
Service Mold + Aerospace Inc.,https://www.service-mold.com/,https://windsornewstoday.ca/windsor/news/2023/03/01/windsor-aerospace-firm-benefit-government-grant,Windsor aerospace firm to benefit from government grant,3/1/2023,Windsor News Today (BlackburnNews.com),"Windsor aerospace firm to benefit from government grant — Windsor News Today (2023-03-01)
FedDev Ontario invests to boost productivity and green practices in six aerospace projects; Service Mold + Aerospace to receive over $3.8 million repayable investment for four CNC machines; will maintain 27 jobs and create 15 new jobs.
""This FedDev Ontario support will allow Service Mold + Aerospace to invest in state‑of‑the‑art CNC equipment and increase manufacturing capacity to meet the industry's demands … hire train and retain highly skilled tradespeople."" — Myles Schuurman, Vice President, Windsor News Today."
Service Mold + Aerospace Inc.,https://www.service-mold.com/,https://www.canada.ca/en/economic-development-southern-ontario/news/2023/02/backgrounder-over-22-million-in-government-of-canada-support-for-six-projects-in-southern-ontarios-aerospace-sector.html,Backgrounder: Over $22 million in Government of Canada support for six projects in southern Ontario’s aerospace sector,2/28/2023,Government of Canada (FedDev Ontario),"Backgrounder: Over $22 million in Government of Canada support for six projects in southern Ontario’s aerospace sector — Government of Canada (2023-02-28)
Confirms Service Mold + Aerospace to receive over $3.8 million repayable investment to purchase four CNC machines; aims to reduce lead times commercialize new parts and expand share in rocket supply chain; creates 15 jobs and maintains 27 jobs.
""This FedDev Ontario support will allow Service Mold + Aerospace to invest in state‑of‑the‑art CNC equipment and increase manufacturing capacity to meet the industry's demands."" — Myles Schuurman, Vice President, Government of Canada."
Macfab Manufacturing Inc.,https://macfab.ca/,https://www.exchangeincomecorp.ca/wcm-docs/news/EIF_-_2021_Q3_Press_Release_v6_Final_20211111153053.pdf,Exchange Income Corporation Achieves Record Revenue; acquires Macfab Manufacturing Inc.,11/11/2021,Exchange Income Corporation (news release),"Exchange Income Corporation Achieves Record Revenue; acquires Macfab Manufacturing Inc. — EIC news release (2021-11-11)
Parent company discloses acquisition of Macfab Manufacturing Inc. for $12 million; Macfab aligned with Ben Machine operations; expands manufacturing segment.
No direct quotes appear in this article."
Macfab Manufacturing Inc.,https://macfab.ca/,https://www.marketscreener.com/quote/stock/EXCHANGE-INCOME-CORPORATI-1409855/news/Exchange-Income-Corporation-acquired-Macfab-Manufacturing-Inc-for-CAD-11-million-36157788/,Exchange Income Corporation acquired Macfab Manufacturing Inc. for CAD 11 million,8/11/2021,MarketScreener (S&P Capital IQ),"Exchange Income Corporation acquired Macfab Manufacturing Inc. for CAD 11 million — MarketScreener (2021-08-11)
Deal note states EIC paid CAD 2 million in shares and CAD 9 million cash; cites integration with Ben Machine operations.
No direct quotes appear in this article."
MTD Micro Molding,https://www.mtdmicromolding.com/,https://www.mtdmicromolding.com/news/mtd-micro-molding-wins-2025-global-medical-design-excellence-award/,MTD Micro Molding Wins 2025 Global Medical Design Excellence Award,6/15/2025,MTD Micro Molding News,"MTD Micro Molding Wins 2025 Global Medical Design Excellence Award — MTD (2025-06-15)
Company honored for micro molded bioabsorbable implant project; award presented at MD&M East; reinforces leadership in medical micro molding.
""Winning this award validates the hard work of our entire team and our focus on solving the most difficult micro molding challenges."" — Dennis Tully, President, MTD Micro Molding."
Medical Rubber Products (MRPC),https://www.mrpcorp.com/,https://www.mrpcorp.com/news/mrpc-acquires-medtech-silicone-solutions/,MRPC Acquires MedTech Silicone Solutions,10/4/2023,MRPC News,"MRPC Acquires MedTech Silicone Solutions — MRPC (2023-10-04)
Acquisition expands MRPC’s silicone molding and medical device component manufacturing capability; includes ISO13485 certified facility in Pennsylvania.
No direct quotes appear in this article."
"Hobson & Motzer, Inc.",https://www.hobsonmotzer.com/,https://www.hobsonmotzer.com/news/hobson-motzer-expands-connecticut-operations/,Hobson & Motzer Expands Connecticut Operations,2/12/2024,Hobson & Motzer News,"Hobson & Motzer Expands Connecticut Operations — Hobson & Motzer (2024-02-12)
Company expands Durham CT facility by 25,000 sq ft; investment in precision metal stamping and machining capacity; adds new hires and automation.
""This expansion will allow us to continue to meet the needs of our global medical device customers with increased efficiency and capacity."" — Robert Motzer, CEO, Hobson & Motzer."
Burteck LLC,https://burteckllc.com/,https://www.moldmakingtechnology.com/articles/mold-builder-meets-increased-domestic-demand-with-automated-cells,Mold Builder Meets Increased Domestic Demand With Automated Cells,6/23/2023,MoldMaking Technology,"Mold Builder Meets Increased Domestic Demand With Automated Cells — MoldMaking Technology (2023-06-23)
Burteck LLC experienced surging domestic demand (reshoring trend) and invested in automated machining cells to scale up output rapidly; technology upgrade described.
No direct quotes appear in this article."
Burteck LLC,https://burteckllc.com/,https://www.plasticsnews.com/news/connecticut-mold-maker-growing-moving-larger-space,"Connecticut mold maker growing, moving to larger space",1/28/2021,Plastics News,"Connecticut mold maker growing, moving to larger space — Plastics News (2021-01-28)
Burteck plans to relocate to a new facility purchased for $1.4 million to support growth in mold production; real estate and expansion move.
No direct quotes appear in this article."
Burteck LLC,https://burteckllc.com/,https://burteckllc.com/press/,Burteck Meets Increased Domestic Demand With Automated Cells,6/23/2023,Burteck (company press),"Burteck Meets Increased Domestic Demand With Automated Cells — Burteck press release (2023-06-23)
Company notes increased reshoring demand and deployment of automated machining cells to increase capacity and avoid delayed deliveries.
No direct quotes appear in this article."
Basilius Inc.,https://www.basilius.com/,https://www.basilius.com/blog/thriving-into-the-fourth-generation/,Thriving into the Fourth Generation,8/1/2023,Basilius Blog,"Thriving into the Fourth Generation — Basilius Blog (2023-08-01)
Describes leadership transition in September 2022 to new generation; emphasizes continuity, culture, investment in tooling and customer relationships.
No direct quotes appear in this article."
Executool Precision Tooling & Molding,https://www.executool.net/,https://www.executool.net/uncategorized/embracing-2025/,"Embracing 2025: Innovation, Expansion, and Impact",1/9/2025,Executool Latest News,"Embracing 2025: Innovation, Expansion, and Impact — Executool Latest News (2025-01-09)
Company statement about strategic growth and innovation plans in 2025; reflects internal vision and direction.
No direct quotes appear in this article."
"American Tool & Mold, Inc.",https://americantoolandmold.com/,https://www.plasticsnews.com/news/american-tool-mold-shows-upgrades-pursues-new-markets-npe2024,"American Tool & Mold shows upgrades, pursues new markets",5/6/2024,Plastics News,"American Tool & Mold shows upgrades, pursues new markets — Plastics News (2024-05-06)
Article reports ATM investing in new equipment and broadening into new sector markets; includes background on family leadership and direction under CEO Emilia Giannakopoulos.
No direct quotes appear in this article."
"Midstate Mold & Engineering, Inc.",https://www.midstatemold.com/,https://www.midstatemold.com/category/blog/,Engineering Grade vs. Medical Grade Plastics: Which to Choose?,9/24/2025,Midstate Mold Blog,"Engineering Grade vs. Medical Grade Plastics: Which to Choose? — Midstate Mold Blog (2025-09-24)
Blog explains differences in resin classes and use‑case considerations for injection molders and part makers.
No direct quotes appear in this article."
"Advance Mold, Inc.",https://www.advancemold.com/,https://www.plasticsnews.com/news/advance-mold-installs-new-nx3-injection-molding-system,Advance Mold Inc. installs new NX3 injection molding system,5/15/2023,Plastics News,"Advance Mold installs a new NX3 machine offering higher tonnage and faster cycle times; intends to expand capacity and reduce lead times.
No direct quotes appear in this article."
"CNC Industries, Inc.",https://cncindustries.com/,https://www.insideindianabusiness.com/articles/cnc-industries-completes-expansion-in-fort-wayne,CNC Industries Completes Expansion in Fort Wayne,8/20/2019,Inside Indiana Business,"CNC Industries Completes Expansion in Fort Wayne — Inside Indiana Business (2019-08-20)
CNC Industries invested $5.1 million to add 40,000 sq ft at Fort Wayne facility; expected to create 20 new jobs; makes precision machined aerospace and defense parts.
No direct quotes appear in this article."
Pace Industries,https://paceind.com/,https://www.arkansasonline.com/news/2020/jun/01/pace-industries-relocating-hq-to-detroit-area/,Pace Industries relocating HQ to Detroit area,6/1/2020,Arkansas Democrat-Gazette,"Pace Industries relocating HQ to Detroit area — Arkansas Democrat-Gazette (2020-06-01)
Company moved headquarters from Fayetteville AR to Novi MI to be closer to automotive customers; maintains 14 manufacturing facilities in U.S. and Mexico.
No direct quotes appear in this article."
Pace Industries,https://paceind.com/,https://www.diecasting.org/blog/2022/04/07/pace-industries-completes-recapitalization/,Pace Industries Completes Recapitalization,4/7/2022,North American Die Casting Association (NADCA) Blog,"Pace Industries Completes Recapitalization — NADCA Blog (2022-04-07)
Company announced recapitalization with new ownership led by TCW Group and Cerberus; enhances capital structure to support growth.
No direct quotes appear in this article."
"Pride Manufacturing Company, LLC",https://pridemanufacturing.com/,https://www.centralmaine.com/2020/06/16/governor-mills-announces-9-million-in-maine-technology-institute-awards/,Governor Mills announces $9 million in Maine Technology Institute awards,6/16/2020,Portland Press Herald,"Governor Mills announces $9 million in Maine Technology Institute awards — Portland Press Herald (2020-06-16)
Pride Manufacturing received MTI award to support operations in Guilford ME; award part of larger state investment initiative in technology and manufacturing firms.
No direct quotes appear in this article."